Best trial: 14. Best value: 130.532:  38%|███▊      | 15/40 [11:58<11:42, 28.10s/it]Best trial: 14. Best value: 130.532:  38%|███▊      | 15/40 [11:58<11:42, 28.10s/it]Best trial: 14. Best value: 130.532:  40%|████      | 16/40 [11:58<10:44, 26.84s/it]                                                                                    [I 2025-10-06 09:59:10,612] Trial 16 finished with value: 130.54563228762194 and parameters: {'seq_len': 18, 'units': 64, 'dropout': 0.3182781881526315, 'lr': 0.0027912393303472192, 'batch': 128, 'epochs': 56}. Best is trial 14 with value: 130.5315754424959.
Best trial: 14. Best value: 130.532:  40%|████      | 16/40 [12:30<10:44, 26.84s/it]Best trial: 14. Best value: 130.532:  40%|████      | 16/40 [12:30<10:44, 26.84s/it]Best trial: 14. Best value: 130.532:  42%|████▎     | 17/40 [12:30<10:52, 28.39s/it]                                                                                    [I 2025-10-06 09:59:41,683] Trial 17 finished with value: 130.45266742194275 and parameters: {'seq_len': 18, 'units': 64, 'dropout': 0.32818890127467676, 'lr': 0.0024822021217329212, 'batch': 128, 'epochs': 55}. Best is trial 17 with value: 130.45266742194275.
Best trial: 14. Best value: 130.532:  42%|████▎     | 17/40 [13:01<10:52, 28.39s/it]Best trial: 17. Best value: 130.453:  42%|████▎     | 17/40 [13:01<10:52, 28.39s/it]Best trial: 17. Best value: 130.453:  45%|████▌     | 18/40 [13:01<10:42, 29.19s/it]                                                                                    [I 2025-10-06 10:00:25,970] Trial 18 finished with value: 131.18875058956084 and parameters: {'seq_len': 18, 'units': 64, 'dropout': 0.3930744627111219, 'lr': 0.0017872583251968208, 'batch': 64, 'epochs': 76}. Best is trial 17 with value: 130.45266742194275.
Best trial: 17. Best value: 130.453:  45%|████▌     | 18/40 [13:45<10:42, 29.19s/it]Best trial: 17. Best value: 130.453:  45%|████▌     | 18/40 [13:45<10:42, 29.19s/it]Best trial: 17. Best value: 130.453:  48%|████▊     | 19/40 [13:45<11:48, 33.73s/it]                                                                                    [I 2025-10-06 10:00:30,116] Trial 19 pruned. Trial was pruned at epoch 5.
Best trial: 17. Best value: 130.453:  48%|████▊     | 19/40 [13:50<11:48, 33.73s/it]Best trial: 17. Best value: 130.453:  48%|████▊     | 19/40 [13:50<11:48, 33.73s/it]Best trial: 17. Best value: 130.453:  50%|█████     | 20/40 [13:50<08:16, 24.85s/it]                                                                                    [I 2025-10-06 10:00:35,933] Trial 20 pruned. Trial was pruned at epoch 5.
Best trial: 17. Best value: 130.453:  50%|█████     | 20/40 [13:55<08:16, 24.85s/it]Best trial: 17. Best value: 130.453:  50%|█████     | 20/40 [13:55<08:16, 24.85s/it]Best trial: 17. Best value: 130.453:  52%|█████▎    | 21/40 [13:55<06:03, 19.13s/it]                                                                                    [I 2025-10-06 10:01:16,669] Trial 21 finished with value: 130.1381627588541 and parameters: {'seq_len': 18, 'units': 64, 'dropout': 0.3183509774407929, 'lr': 0.002980651144741477, 'batch': 128, 'epochs': 56}. Best is trial 21 with value: 130.1381627588541.
Best trial: 17. Best value: 130.453:  52%|█████▎    | 21/40 [14:36<06:03, 19.13s/it]Best trial: 21. Best value: 130.138:  52%|█████▎    | 21/40 [14:36<06:03, 19.13s/it]Best trial: 21. Best value: 130.138:  55%|█████▌    | 22/40 [14:36<07:41, 25.62s/it]                                                                                    [I 2025-10-06 10:01:39,638] Trial 22 finished with value: 130.8151651066305 and parameters: {'seq_len': 18, 'units': 64, 'dropout': 0.35297136676504126, 'lr': 0.0025375844352066718, 'batch': 128, 'epochs': 58}. Best is trial 21 with value: 130.1381627588541.
Best trial: 21. Best value: 130.138:  55%|█████▌    | 22/40 [14:59<07:41, 25.62s/it]Best trial: 21. Best value: 130.138:  55%|█████▌    | 22/40 [14:59<07:41, 25.62s/it]Best trial: 21. Best value: 130.138:  57%|█████▊    | 23/40 [14:59<07:01, 24.82s/it]                                                                                    [I 2025-10-06 10:02:04,645] Trial 23 finished with value: 130.36893262487808 and parameters: {'seq_len': 18, 'units': 64, 'dropout': 0.30991216258996757, 'lr': 0.00486118768414028, 'batch': 128, 'epochs': 74}. Best is trial 21 with value: 130.1381627588541.
Best trial: 21. Best value: 130.138:  57%|█████▊    | 23/40 [15:24<07:01, 24.82s/it]Best trial: 21. Best value: 130.138:  57%|█████▊    | 23/40 [15:24<07:01, 24.82s/it]Best trial: 21. Best value: 130.138:  60%|██████    | 24/40 [15:24<06:38, 24.88s/it]                                                                                    [I 2025-10-06 10:02:10,367] Trial 24 pruned. Trial was pruned at epoch 5.
Best trial: 21. Best value: 130.138:  60%|██████    | 24/40 [15:30<06:38, 24.88s/it]Best trial: 21. Best value: 130.138:  60%|██████    | 24/40 [15:30<06:38, 24.88s/it]Best trial: 21. Best value: 130.138:  62%|██████▎   | 25/40 [15:30<04:46, 19.13s/it]                                                                                    [I 2025-10-06 10:02:16,165] Trial 25 pruned. Trial was pruned at epoch 5.
Best trial: 21. Best value: 130.138:  62%|██████▎   | 25/40 [15:36<04:46, 19.13s/it]Best trial: 21. Best value: 130.138:  62%|██████▎   | 25/40 [15:36<04:46, 19.13s/it]Best trial: 21. Best value: 130.138:  65%|██████▌   | 26/40 [15:36<03:31, 15.13s/it]                                                                                    [I 2025-10-06 10:02:21,659] Trial 26 pruned. Trial was pruned at epoch 5.
Best trial: 21. Best value: 130.138:  65%|██████▌   | 26/40 [15:41<03:31, 15.13s/it]Best trial: 21. Best value: 130.138:  65%|██████▌   | 26/40 [15:41<03:31, 15.13s/it]Best trial: 21. Best value: 130.138:  68%|██████▊   | 27/40 [15:41<02:39, 12.24s/it]                                                                                    [I 2025-10-06 10:02:27,251] Trial 27 pruned. Trial was pruned at epoch 5.
Best trial: 21. Best value: 130.138:  68%|██████▊   | 27/40 [15:47<02:39, 12.24s/it]Best trial: 21. Best value: 130.138:  68%|██████▊   | 27/40 [15:47<02:39, 12.24s/it]Best trial: 21. Best value: 130.138:  70%|███████   | 28/40 [15:47<02:02, 10.24s/it]                                                                                    [I 2025-10-06 10:02:31,267] Trial 28 pruned. Trial was pruned at epoch 5.
Best trial: 21. Best value: 130.138:  70%|███████   | 28/40 [15:51<02:02, 10.24s/it]Best trial: 21. Best value: 130.138:  70%|███████   | 28/40 [15:51<02:02, 10.24s/it]Best trial: 21. Best value: 130.138:  72%|███████▎  | 29/40 [15:51<01:32,  8.38s/it]                                                                                    [I 2025-10-06 10:02:51,332] Trial 29 pruned. Trial was pruned at epoch 14.
Best trial: 21. Best value: 130.138:  72%|███████▎  | 29/40 [16:11<01:32,  8.38s/it]Best trial: 21. Best value: 130.138:  72%|███████▎  | 29/40 [16:11<01:32,  8.38s/it]Best trial: 21. Best value: 130.138:  75%|███████▌  | 30/40 [16:11<01:58, 11.88s/it]                                                                                    [I 2025-10-06 10:03:00,927] Trial 30 pruned. Trial was pruned at epoch 5.
Best trial: 21. Best value: 130.138:  75%|███████▌  | 30/40 [16:20<01:58, 11.88s/it]Best trial: 21. Best value: 130.138:  75%|███████▌  | 30/40 [16:20<01:58, 11.88s/it]Best trial: 21. Best value: 130.138:  78%|███████▊  | 31/40 [16:20<01:40, 11.20s/it]                                                                                    [I 2025-10-06 10:03:27,121] Trial 31 finished with value: 131.25481389981474 and parameters: {'seq_len': 18, 'units': 64, 'dropout': 0.31089126385303223, 'lr': 0.004930822412106053, 'batch': 128, 'epochs': 68}. Best is trial 21 with value: 130.1381627588541.
Best trial: 21. Best value: 130.138:  78%|███████▊  | 31/40 [16:47<01:40, 11.20s/it]Best trial: 21. Best value: 130.138:  78%|███████▊  | 31/40 [16:47<01:40, 11.20s/it]Best trial: 21. Best value: 130.138:  80%|████████  | 32/40 [16:47<02:05, 15.70s/it]                                                                                    [I 2025-10-06 10:03:57,640] Trial 32 finished with value: 130.72769587486042 and parameters: {'seq_len': 18, 'units': 64, 'dropout': 0.3083424310367533, 'lr': 0.0030518634038928802, 'batch': 128, 'epochs': 83}. Best is trial 21 with value: 130.1381627588541.
Best trial: 21. Best value: 130.138:  80%|████████  | 32/40 [17:17<02:05, 15.70s/it]Best trial: 21. Best value: 130.138:  80%|████████  | 32/40 [17:17<02:05, 15.70s/it]Best trial: 21. Best value: 130.138:  82%|████████▎ | 33/40 [17:17<02:20, 20.14s/it]                                                                                    [I 2025-10-06 10:04:03,384] Trial 33 pruned. Trial was pruned at epoch 5.
Best trial: 21. Best value: 130.138:  82%|████████▎ | 33/40 [17:23<02:20, 20.14s/it]Best trial: 21. Best value: 130.138:  82%|████████▎ | 33/40 [17:23<02:20, 20.14s/it]Best trial: 21. Best value: 130.138:  85%|████████▌ | 34/40 [17:23<01:34, 15.82s/it]                                                                                    [I 2025-10-06 10:04:09,261] Trial 34 pruned. Trial was pruned at epoch 5.
Best trial: 21. Best value: 130.138:  85%|████████▌ | 34/40 [17:29<01:34, 15.82s/it]Best trial: 21. Best value: 130.138:  85%|████████▌ | 34/40 [17:29<01:34, 15.82s/it]Best trial: 21. Best value: 130.138:  88%|████████▊ | 35/40 [17:29<01:04, 12.84s/it]                                                                                    [I 2025-10-06 10:04:14,573] Trial 35 pruned. Trial was pruned at epoch 5.
Best trial: 21. Best value: 130.138:  88%|████████▊ | 35/40 [17:34<01:04, 12.84s/it]Best trial: 21. Best value: 130.138:  88%|████████▊ | 35/40 [17:34<01:04, 12.84s/it]Best trial: 21. Best value: 130.138:  90%|█████████ | 36/40 [17:34<00:42, 10.58s/it]                                                                                    [I 2025-10-06 10:04:20,080] Trial 36 pruned. Trial was pruned at epoch 5.
Best trial: 21. Best value: 130.138:  90%|█████████ | 36/40 [17:39<00:42, 10.58s/it]Best trial: 21. Best value: 130.138:  90%|█████████ | 36/40 [17:39<00:42, 10.58s/it]Best trial: 21. Best value: 130.138:  92%|█████████▎| 37/40 [17:39<00:27,  9.06s/it]                                                                                    [I 2025-10-06 10:04:24,219] Trial 37 pruned. Trial was pruned at epoch 5.
Best trial: 21. Best value: 130.138:  92%|█████████▎| 37/40 [17:44<00:27,  9.06s/it]Best trial: 21. Best value: 130.138:  92%|█████████▎| 37/40 [17:44<00:27,  9.06s/it]Best trial: 21. Best value: 130.138:  95%|█████████▌| 38/40 [17:44<00:15,  7.58s/it]                                                                                    [I 2025-10-06 10:04:44,711] Trial 38 finished with value: 130.70499942618875 and parameters: {'seq_len': 24, 'units': 96, 'dropout': 0.2656025680671056, 'lr': 0.0039084980499806375, 'batch': 128, 'epochs': 61}. Best is trial 21 with value: 130.1381627588541.
Best trial: 21. Best value: 130.138:  95%|█████████▌| 38/40 [18:04<00:15,  7.58s/it]Best trial: 21. Best value: 130.138:  95%|█████████▌| 38/40 [18:04<00:15,  7.58s/it]Best trial: 21. Best value: 130.138:  98%|█████████▊| 39/40 [18:04<00:11, 11.46s/it]                                                                                    [I 2025-10-06 10:04:54,136] Trial 39 pruned. Trial was pruned at epoch 5.
Best trial: 21. Best value: 130.138:  98%|█████████▊| 39/40 [18:14<00:11, 11.46s/it]Best trial: 21. Best value: 130.138:  98%|█████████▊| 39/40 [18:14<00:11, 11.46s/it]Best trial: 21. Best value: 130.138: 100%|██████████| 40/40 [18:14<00:00, 10.85s/it]Best trial: 21. Best value: 130.138: 100%|██████████| 40/40 [18:14<00:00, 27.35s/it]
/home/e.ladino/miniconda3/envs/e_ladino/lib/python3.12/site-packages/keras/src/saving/saving_lib.py:797: UserWarning: Skipping variable loading for optimizer 'adam', because it has 2 variables whereas the saved optimizer has 12 variables. 
  saveable.load_own_variables(weights_store.get(inner_path))
Best LSTM params: {'seq_len': 18, 'units': 64, 'dropout': 0.3183509774407929, 'lr': 0.002980651144741477, 'batch': 128, 'epochs': 56}
LSTM test → RMSE: 136.8780 | MAE: 71.1631 | R2: 0.7177 | Skill: 0.303
/mnt/SOLARLAB/E_Ladino/Repo/irradiance-fusion-forecast/Notebooks/05_ground_hpo_optuna_v1.py:141: FutureWarning: The import path :class:`~optuna.storages.JournalFileOpenLock` has been deprecated in v4.0.0. This feature will be removed in v6.0.0. See https://github.com/optuna/optuna/releases/tag/v4.0.0. Use :class:`~optuna.storages.journal.JournalFileOpenLock` instead.
  file_storage = JournalFileStorage(str(log_path), lock_obj=JournalFileOpenLock(str(lock_path)))
/mnt/SOLARLAB/E_Ladino/Repo/irradiance-fusion-forecast/Notebooks/05_ground_hpo_optuna_v1.py:141: FutureWarning: JournalFileStorage has been deprecated in v4.0.0. This feature will be removed in v6.0.0. See https://github.com/optuna/optuna/releases/tag/v4.0.0. Use :class:`~optuna.storages.journal.JournalFileBackend` instead.
  file_storage = JournalFileStorage(str(log_path), lock_obj=JournalFileOpenLock(str(lock_path)))
[I 2025-10-06 10:04:54,519] A new study created in Journal with name: ground_trackB_bilstm
Running Study B2 (BiLSTM)…
  0%|          | 0/35 [00:00<?, ?it/s]                                      [I 2025-10-06 10:06:09,952] Trial 0 finished with value: 221.9838377421879 and parameters: {'seq_len': 12, 'units': 32, 'dropout': 0.062397808134481064, 'lr': 6.533369619026643e-05, 'batch': 64, 'epochs': 41}. Best is trial 0 with value: 221.9838377421879.
  0%|          | 0/35 [01:15<?, ?it/s]Best trial: 0. Best value: 221.984:   0%|          | 0/35 [01:15<?, ?it/s]Best trial: 0. Best value: 221.984:   3%|▎         | 1/35 [01:15<42:44, 75.43s/it]                                                                                  [I 2025-10-06 10:06:42,383] Trial 1 finished with value: 155.71954959156542 and parameters: {'seq_len': 6, 'units': 32, 'dropout': 0.1216968971838151, 'lr': 0.0005603803105930283, 'batch': 256, 'epochs': 51}. Best is trial 1 with value: 155.71954959156542.
Best trial: 0. Best value: 221.984:   3%|▎         | 1/35 [01:47<42:44, 75.43s/it]Best trial: 1. Best value: 155.72:   3%|▎         | 1/35 [01:47<42:44, 75.43s/it] Best trial: 1. Best value: 155.72:   6%|▌         | 2/35 [01:47<27:34, 50.14s/it]                                                                                 [I 2025-10-06 10:07:35,909] Trial 2 finished with value: 132.0135528080356 and parameters: {'seq_len': 24, 'units': 32, 'dropout': 0.20569377536544464, 'lr': 0.000765242606091573, 'batch': 128, 'epochs': 45}. Best is trial 2 with value: 132.0135528080356.
Best trial: 1. Best value: 155.72:   6%|▌         | 2/35 [02:41<27:34, 50.14s/it]Best trial: 2. Best value: 132.014:   6%|▌         | 2/35 [02:41<27:34, 50.14s/it]Best trial: 2. Best value: 132.014:   9%|▊         | 3/35 [02:41<27:33, 51.68s/it]                                                                                  [I 2025-10-06 10:09:07,601] Trial 3 finished with value: 132.03171227729723 and parameters: {'seq_len': 12, 'units': 32, 'dropout': 0.2736932106048628, 'lr': 0.0003795552402641347, 'batch': 128, 'epochs': 113}. Best is trial 2 with value: 132.0135528080356.
Best trial: 2. Best value: 132.014:   9%|▊         | 3/35 [04:13<27:33, 51.68s/it]Best trial: 2. Best value: 132.014:   9%|▊         | 3/35 [04:13<27:33, 51.68s/it]Best trial: 2. Best value: 132.014:  11%|█▏        | 4/35 [04:13<34:51, 67.48s/it]                                                                                  [I 2025-10-06 10:09:28,772] Trial 4 finished with value: 131.5417813258396 and parameters: {'seq_len': 12, 'units': 96, 'dropout': 0.07394178221021082, 'lr': 0.004346495755569775, 'batch': 128, 'epochs': 88}. Best is trial 4 with value: 131.5417813258396.
Best trial: 2. Best value: 132.014:  11%|█▏        | 4/35 [04:34<34:51, 67.48s/it]Best trial: 4. Best value: 131.542:  11%|█▏        | 4/35 [04:34<34:51, 67.48s/it]Best trial: 4. Best value: 131.542:  14%|█▍        | 5/35 [04:34<25:23, 50.78s/it]                                                                                  [I 2025-10-06 10:11:15,561] Trial 5 finished with value: 133.58543468273402 and parameters: {'seq_len': 6, 'units': 64, 'dropout': 0.15547091587579281, 'lr': 0.0001744488327445185, 'batch': 64, 'epochs': 83}. Best is trial 4 with value: 131.5417813258396.
Best trial: 4. Best value: 131.542:  14%|█▍        | 5/35 [06:21<25:23, 50.78s/it]Best trial: 4. Best value: 131.542:  14%|█▍        | 5/35 [06:21<25:23, 50.78s/it]Best trial: 4. Best value: 131.542:  17%|█▋        | 6/35 [06:21<33:44, 69.82s/it]                                                                                  [I 2025-10-06 10:14:19,298] Trial 6 finished with value: 133.82844516161353 and parameters: {'seq_len': 24, 'units': 128, 'dropout': 0.07948627261366897, 'lr': 5.12878198709283e-05, 'batch': 64, 'epochs': 102}. Best is trial 4 with value: 131.5417813258396.
Best trial: 4. Best value: 131.542:  17%|█▋        | 6/35 [09:24<33:44, 69.82s/it]Best trial: 4. Best value: 131.542:  17%|█▋        | 6/35 [09:24<33:44, 69.82s/it]Best trial: 4. Best value: 131.542:  20%|██        | 7/35 [09:24<49:57, 107.06s/it]                                                                                   [I 2025-10-06 10:15:29,889] Trial 7 finished with value: 182.8345392697999 and parameters: {'seq_len': 24, 'units': 96, 'dropout': 0.13235920994105968, 'lr': 6.700183621677408e-05, 'batch': 256, 'epochs': 91}. Best is trial 4 with value: 131.5417813258396.
Best trial: 4. Best value: 131.542:  20%|██        | 7/35 [10:35<49:57, 107.06s/it]Best trial: 4. Best value: 131.542:  20%|██        | 7/35 [10:35<49:57, 107.06s/it]Best trial: 4. Best value: 131.542:  23%|██▎       | 8/35 [10:35<42:57, 95.45s/it]                                                                                   [I 2025-10-06 10:15:52,059] Trial 8 finished with value: 131.80154945030046 and parameters: {'seq_len': 6, 'units': 128, 'dropout': 0.2245108790277985, 'lr': 0.0017414233532634423, 'batch': 128, 'epochs': 42}. Best is trial 4 with value: 131.5417813258396.
Best trial: 4. Best value: 131.542:  23%|██▎       | 8/35 [10:57<42:57, 95.45s/it]Best trial: 4. Best value: 131.542:  23%|██▎       | 8/35 [10:57<42:57, 95.45s/it]Best trial: 4. Best value: 131.542:  26%|██▌       | 9/35 [10:57<31:26, 72.54s/it]                                                                                  [I 2025-10-06 10:16:44,470] Trial 9 finished with value: 140.14026176923605 and parameters: {'seq_len': 18, 'units': 96, 'dropout': 0.3630265895704372, 'lr': 0.00015759936475969445, 'batch': 128, 'epochs': 46}. Best is trial 4 with value: 131.5417813258396.
Best trial: 4. Best value: 131.542:  26%|██▌       | 9/35 [11:49<31:26, 72.54s/it]Best trial: 4. Best value: 131.542:  26%|██▌       | 9/35 [11:49<31:26, 72.54s/it]Best trial: 4. Best value: 131.542:  29%|██▊       | 10/35 [11:49<27:38, 66.33s/it]                                                                                   [I 2025-10-06 10:17:03,900] Trial 10 finished with value: 132.95272009722103 and parameters: {'seq_len': 12, 'units': 64, 'dropout': 0.003018927726517212, 'lr': 0.004065894145021779, 'batch': 128, 'epochs': 67}. Best is trial 4 with value: 131.5417813258396.
Best trial: 4. Best value: 131.542:  29%|██▊       | 10/35 [12:09<27:38, 66.33s/it]Best trial: 4. Best value: 131.542:  29%|██▊       | 10/35 [12:09<27:38, 66.33s/it]Best trial: 4. Best value: 131.542:  31%|███▏      | 11/35 [12:09<20:47, 51.97s/it]                                                                                   [I 2025-10-06 10:17:21,868] Trial 11 finished with value: 132.01777667941164 and parameters: {'seq_len': 6, 'units': 128, 'dropout': 0.25075345796262716, 'lr': 0.004708150953017604, 'batch': 128, 'epochs': 68}. Best is trial 4 with value: 131.5417813258396.
Best trial: 4. Best value: 131.542:  31%|███▏      | 11/35 [12:27<20:47, 51.97s/it]Best trial: 4. Best value: 131.542:  31%|███▏      | 11/35 [12:27<20:47, 51.97s/it]Best trial: 4. Best value: 131.542:  34%|███▍      | 12/35 [12:27<15:57, 41.63s/it]                                                                                   [I 2025-10-06 10:17:57,221] Trial 12 finished with value: 131.7512600746194 and parameters: {'seq_len': 18, 'units': 128, 'dropout': 0.320783922424235, 'lr': 0.0018208433729206238, 'batch': 128, 'epochs': 66}. Best is trial 4 with value: 131.5417813258396.
Best trial: 4. Best value: 131.542:  34%|███▍      | 12/35 [13:02<15:57, 41.63s/it]Best trial: 4. Best value: 131.542:  34%|███▍      | 12/35 [13:02<15:57, 41.63s/it]Best trial: 4. Best value: 131.542:  37%|███▋      | 13/35 [13:02<14:34, 39.73s/it]                                                                                   [I 2025-10-06 10:18:25,808] Trial 13 finished with value: 130.5752821052859 and parameters: {'seq_len': 18, 'units': 96, 'dropout': 0.3673272965336669, 'lr': 0.0019082778124317615, 'batch': 128, 'epochs': 67}. Best is trial 13 with value: 130.5752821052859.
