nohup: ignoring input
2025-10-06 09:38:59.019355: I tensorflow/core/util/port.cc:153] oneDNN custom operations are on. You may see slightly different numerical results due to floating-point round-off errors from different computation orders. To turn them off, set the environment variable `TF_ENABLE_ONEDNN_OPTS=0`.
2025-10-06 09:38:59.024586: E external/local_xla/xla/stream_executor/cuda/cuda_fft.cc:477] Unable to register cuFFT factory: Attempting to register factory for plugin cuFFT when one has already been registered
WARNING: All log messages before absl::InitializeLog() is called are written to STDERR
E0000 00:00:1759761539.030424 1218911 cuda_dnn.cc:8310] Unable to register cuDNN factory: Attempting to register factory for plugin cuDNN when one has already been registered
E0000 00:00:1759761539.032429 1218911 cuda_blas.cc:1418] Unable to register cuBLAS factory: Attempting to register factory for plugin cuBLAS when one has already been registered
2025-10-06 09:38:59.039107: I tensorflow/core/platform/cpu_feature_guard.cc:210] This TensorFlow binary is optimized to use available CPU instructions in performance-critical operations.
To enable the following instructions: SSE4.1 SSE4.2 AVX AVX2 AVX512F AVX512_VNNI AVX512_BF16 AVX_VNNI FMA, in other operations, rebuild TensorFlow with the appropriate compiler flags.
Studies dir: /mnt/SOLARLAB/E_Ladino/Repo/irradiance-fusion-forecast/optuna_studies
Artifacts dir: /mnt/SOLARLAB/E_Ladino/Repo/irradiance-fusion-forecast/models/optuna_artifacts
Baseline → RMSE: 196.2835 | MAE: 102.1871
/mnt/SOLARLAB/E_Ladino/Repo/irradiance-fusion-forecast/Notebooks/05_ground_hpo_optuna_v1.py:141: FutureWarning: The import path :class:`~optuna.storages.JournalFileOpenLock` has been deprecated in v4.0.0. This feature will be removed in v6.0.0. See https://github.com/optuna/optuna/releases/tag/v4.0.0. Use :class:`~optuna.storages.journal.JournalFileOpenLock` instead.
  file_storage = JournalFileStorage(str(log_path), lock_obj=JournalFileOpenLock(str(lock_path)))
/mnt/SOLARLAB/E_Ladino/Repo/irradiance-fusion-forecast/Notebooks/05_ground_hpo_optuna_v1.py:141: FutureWarning: JournalFileStorage has been deprecated in v4.0.0. This feature will be removed in v6.0.0. See https://github.com/optuna/optuna/releases/tag/v4.0.0. Use :class:`~optuna.storages.journal.JournalFileBackend` instead.
  file_storage = JournalFileStorage(str(log_path), lock_obj=JournalFileOpenLock(str(lock_path)))
[I 2025-10-06 09:39:01,386] Using an existing study with name 'ground_trackA_mlp' instead of creating a new one.
Running Study A (MLP)…
  0%|          | 0/40 [00:00<?, ?it/s]I0000 00:00:1759761541.730751 1218911 gpu_device.cc:2022] Created device /job:localhost/replica:0/task:0/device:GPU:0 with 21474 MB memory:  -> device: 0, name: NVIDIA GeForce RTX 4090, pci bus id: 0000:01:00.0, compute capability: 8.9
I0000 00:00:1759761542.414521 1219050 service.cc:148] XLA service 0x71222000a710 initialized for platform CUDA (this does not guarantee that XLA will be used). Devices:
I0000 00:00:1759761542.414549 1219050 service.cc:156]   StreamExecutor device (0): NVIDIA GeForce RTX 4090, Compute Capability 8.9
2025-10-06 09:39:02.424423: I tensorflow/compiler/mlir/tensorflow/utils/dump_mlir_util.cc:268] disabling MLIR crash reproducer, set env var `MLIR_CRASH_REPRODUCER_DIRECTORY` to enable.
I0000 00:00:1759761542.461807 1219050 cuda_dnn.cc:529] Loaded cuDNN version 90101
I0000 00:00:1759761542.888770 1219050 device_compiler.h:188] Compiled cluster using XLA!  This line is logged at most once for the lifetime of the process.
                                      [I 2025-10-06 09:39:18,729] Trial 6 finished with value: 131.17293868687244 and parameters: {'n1': 192, 'n2': 96, 'do1': 0.36599697090570255, 'do2': 0.2993292420985183, 'lr': 0.00018410729205738696, 'l2': 6.02521573620385e-08, 'act': 'selu', 'batch': 256, 'epochs': 63}. Best is trial 1 with value: 130.37151691176643.
  0%|          | 0/40 [00:17<?, ?it/s]Best trial: 1. Best value: 130.372:   0%|          | 0/40 [00:17<?, ?it/s]Best trial: 1. Best value: 130.372:   2%|▎         | 1/40 [00:17<11:16, 17.34s/it]                                                                                  [I 2025-10-06 09:39:38,480] Trial 7 finished with value: 130.4450839314192 and parameters: {'n1': 128, 'n2': 32, 'do1': 0.15212112147976886, 'do2': 0.2623782158161189, 'lr': 0.0005418282319533242, 'l2': 2.8585493941961875e-07, 'act': 'relu', 'batch': 256, 'epochs': 97}. Best is trial 1 with value: 130.37151691176643.
Best trial: 1. Best value: 130.372:   2%|▎         | 1/40 [00:37<11:16, 17.34s/it]Best trial: 1. Best value: 130.372:   2%|▎         | 1/40 [00:37<11:16, 17.34s/it]Best trial: 1. Best value: 130.372:   5%|▌         | 2/40 [00:37<11:52, 18.76s/it]2025-10-06 09:39:40.596741: I external/local_xla/xla/stream_executor/cuda/cuda_asm_compiler.cc:397] ptxas warning : Registers are spilled to local memory in function 'gemm_fusion_dot_48', 24 bytes spill stores, 24 bytes spill loads

2025-10-06 09:39:40.653223: I external/local_xla/xla/stream_executor/cuda/cuda_asm_compiler.cc:397] ptxas warning : Registers are spilled to local memory in function 'gemm_fusion_dot_48', 388 bytes spill stores, 388 bytes spill loads

2025-10-06 09:39:41.105331: I external/local_xla/xla/stream_executor/cuda/cuda_asm_compiler.cc:397] ptxas warning : Registers are spilled to local memory in function 'gemm_fusion_dot_48', 48 bytes spill stores, 48 bytes spill loads

2025-10-06 09:39:41.172145: I external/local_xla/xla/stream_executor/cuda/cuda_asm_compiler.cc:397] ptxas warning : Registers are spilled to local memory in function 'gemm_fusion_dot_48', 404 bytes spill stores, 404 bytes spill loads

2025-10-06 09:40:16.316513: I external/local_xla/xla/stream_executor/cuda/cuda_asm_compiler.cc:397] ptxas warning : Registers are spilled to local memory in function 'gemm_fusion_dot_16', 24 bytes spill stores, 24 bytes spill loads

                                                                                  [I 2025-10-06 09:40:16,661] Trial 8 finished with value: 130.94762788993162 and parameters: {'n1': 320, 'n2': 32, 'do1': 0.3037724259507192, 'do2': 0.08526206184364576, 'lr': 0.00012897950480855554, 'l2': 0.000555172168524472, 'act': 'relu', 'batch': 128, 'epochs': 94}. Best is trial 1 with value: 130.37151691176643.
Best trial: 1. Best value: 130.372:   5%|▌         | 2/40 [01:15<11:52, 18.76s/it]Best trial: 1. Best value: 130.372:   5%|▌         | 2/40 [01:15<11:52, 18.76s/it]Best trial: 1. Best value: 130.372:   8%|▊         | 3/40 [01:15<17:02, 27.63s/it]                                                                                  [I 2025-10-06 09:40:40,642] Trial 9 pruned. Trial was pruned at epoch 63.
Best trial: 1. Best value: 130.372:   8%|▊         | 3/40 [01:39<17:02, 27.63s/it]Best trial: 1. Best value: 130.372:   8%|▊         | 3/40 [01:39<17:02, 27.63s/it]Best trial: 1. Best value: 130.372:  10%|█         | 4/40 [01:39<15:42, 26.19s/it]                                                                                  [I 2025-10-06 09:40:44,022] Trial 10 pruned. Trial was pruned at epoch 5.
Best trial: 1. Best value: 130.372:  10%|█         | 4/40 [01:42<15:42, 26.19s/it]Best trial: 1. Best value: 130.372:  10%|█         | 4/40 [01:42<15:42, 26.19s/it]Best trial: 1. Best value: 130.372:  12%|█▎        | 5/40 [01:42<10:28, 17.96s/it]                                                                                  [I 2025-10-06 09:40:54,640] Trial 11 finished with value: 130.37863279933947 and parameters: {'n1': 512, 'n2': 224, 'do1': 0.4847685553939329, 'do2': 0.4661451709558935, 'lr': 0.0018460840016650518, 'l2': 2.8264113462394305e-05, 'act': 'selu', 'batch': 512, 'epochs': 119}. Best is trial 1 with value: 130.37151691176643.
Best trial: 1. Best value: 130.372:  12%|█▎        | 5/40 [01:53<10:28, 17.96s/it]Best trial: 1. Best value: 130.372:  12%|█▎        | 5/40 [01:53<10:28, 17.96s/it]Best trial: 1. Best value: 130.372:  15%|█▌        | 6/40 [01:53<08:45, 15.47s/it]                                                                                  [I 2025-10-06 09:41:04,660] Trial 12 finished with value: 130.5267049424178 and parameters: {'n1': 512, 'n2': 224, 'do1': 0.47290485998685655, 'do2': 0.4774239217162434, 'lr': 0.0017724741404585244, 'l2': 3.262091689107177e-05, 'act': 'selu', 'batch': 512, 'epochs': 116}. Best is trial 1 with value: 130.37151691176643.
Best trial: 1. Best value: 130.372:  15%|█▌        | 6/40 [02:03<08:45, 15.47s/it]Best trial: 1. Best value: 130.372:  15%|█▌        | 6/40 [02:03<08:45, 15.47s/it]Best trial: 1. Best value: 130.372:  18%|█▊        | 7/40 [02:03<07:31, 13.69s/it]                                                                                  [I 2025-10-06 09:41:15,282] Trial 13 finished with value: 130.57597016440275 and parameters: {'n1': 512, 'n2': 224, 'do1': 0.4620915240135678, 'do2': 0.49838445050542113, 'lr': 0.0016970700181232557, 'l2': 3.50498209146749e-05, 'act': 'selu', 'batch': 512, 'epochs': 119}. Best is trial 1 with value: 130.37151691176643.
Best trial: 1. Best value: 130.372:  18%|█▊        | 7/40 [02:13<07:31, 13.69s/it]Best trial: 1. Best value: 130.372:  18%|█▊        | 7/40 [02:13<07:31, 13.69s/it]Best trial: 1. Best value: 130.372:  20%|██        | 8/40 [02:13<06:46, 12.71s/it]                                                                                  [I 2025-10-06 09:41:32,962] Trial 14 finished with value: 130.8579636117917 and parameters: {'n1': 384, 'n2': 128, 'do1': 0.21088679073511474, 'do2': 0.41293411922682, 'lr': 0.004329738785929869, 'l2': 1.341984420640569e-08, 'act': 'selu', 'batch': 64, 'epochs': 116}. Best is trial 1 with value: 130.37151691176643.
Best trial: 1. Best value: 130.372:  20%|██        | 8/40 [02:31<06:46, 12.71s/it]Best trial: 1. Best value: 130.372:  20%|██        | 8/40 [02:31<06:46, 12.71s/it]Best trial: 1. Best value: 130.372:  22%|██▎       | 9/40 [02:31<07:22, 14.26s/it]                                                                                  [I 2025-10-06 09:41:43,040] Trial 15 finished with value: 130.07119444750248 and parameters: {'n1': 448, 'n2': 192, 'do1': 0.23105737920056402, 'do2': 0.3892166220853729, 'lr': 0.0011808462911388682, 'l2': 3.9315827299907635e-05, 'act': 'gelu', 'batch': 512, 'epochs': 78}. Best is trial 15 with value: 130.07119444750248.
Best trial: 1. Best value: 130.372:  22%|██▎       | 9/40 [02:41<07:22, 14.26s/it]Best trial: 15. Best value: 130.071:  22%|██▎       | 9/40 [02:41<07:22, 14.26s/it]Best trial: 15. Best value: 130.071:  25%|██▌       | 10/40 [02:41<06:29, 12.97s/it]                                                                                    [I 2025-10-06 09:42:07,164] Trial 16 finished with value: 130.27450735130415 and parameters: {'n1': 384, 'n2': 160, 'do1': 0.22829310219846358, 'do2': 0.4049125728568978, 'lr': 0.0009303213441560056, 'l2': 1.0284384093335595e-06, 'act': 'gelu', 'batch': 64, 'epochs': 78}. Best is trial 15 with value: 130.07119444750248.
Best trial: 15. Best value: 130.071:  25%|██▌       | 10/40 [03:05<06:29, 12.97s/it]Best trial: 15. Best value: 130.071:  25%|██▌       | 10/40 [03:05<06:29, 12.97s/it]Best trial: 15. Best value: 130.071:  28%|██▊       | 11/40 [03:05<07:55, 16.38s/it]                                                                                    [I 2025-10-06 09:42:28,656] Trial 17 finished with value: 130.51646956658382 and parameters: {'n1': 384, 'n2': 160, 'do1': 0.2298356408716007, 'do2': 0.39951934417331, 'lr': 0.001172763730946484, 'l2': 1.0028168982127676e-05, 'act': 'gelu', 'batch': 64, 'epochs': 41}. Best is trial 15 with value: 130.07119444750248.
Best trial: 15. Best value: 130.071:  28%|██▊       | 11/40 [03:27<07:55, 16.38s/it]Best trial: 15. Best value: 130.071:  28%|██▊       | 11/40 [03:27<07:55, 16.38s/it]Best trial: 15. Best value: 130.071:  30%|███       | 12/40 [03:27<08:22, 17.94s/it]                                                                                    [I 2025-10-06 09:42:53,300] Trial 18 finished with value: 130.18733497349118 and parameters: {'n1': 448, 'n2': 160, 'do1': 0.28254536530483404, 'do2': 0.3968772960934167, 'lr': 0.0009268844855446789, 'l2': 9.53646058214302e-05, 'act': 'gelu', 'batch': 64, 'epochs': 74}. Best is trial 15 with value: 130.07119444750248.
Best trial: 15. Best value: 130.071:  30%|███       | 12/40 [03:51<08:22, 17.94s/it]Best trial: 15. Best value: 130.071:  30%|███       | 12/40 [03:51<08:22, 17.94s/it]Best trial: 15. Best value: 130.071:  32%|███▎      | 13/40 [03:51<08:59, 19.97s/it]                                                                                    [I 2025-10-06 09:43:04,110] Trial 19 finished with value: 131.18271340719784 and parameters: {'n1': 448, 'n2': 192, 'do1': 0.310829961962555, 'do2': 0.008198863860606476, 'lr': 0.0034652336603720694, 'l2': 0.00013625001376651005, 'act': 'gelu', 'batch': 64, 'epochs': 72}. Best is trial 15 with value: 130.07119444750248.
Best trial: 15. Best value: 130.071:  32%|███▎      | 13/40 [04:02<08:59, 19.97s/it]Best trial: 15. Best value: 130.071:  32%|███▎      | 13/40 [04:02<08:59, 19.97s/it]Best trial: 15. Best value: 130.071:  35%|███▌      | 14/40 [04:02<07:27, 17.20s/it]                                                                                    [I 2025-10-06 09:43:16,063] Trial 20 finished with value: 130.10679957971067 and parameters: {'n1': 448, 'n2': 160, 'do1': 0.40826763400526844, 'do2': 0.3803609155918469, 'lr': 0.0008928729201508562, 'l2': 9.45940839936272e-05, 'act': 'gelu', 'batch': 512, 'epochs': 44}. Best is trial 15 with value: 130.07119444750248.
Best trial: 15. Best value: 130.071:  35%|███▌      | 14/40 [04:14<07:27, 17.20s/it]Best trial: 15. Best value: 130.071:  35%|███▌      | 14/40 [04:14<07:27, 17.20s/it]Best trial: 15. Best value: 130.071:  38%|███▊      | 15/40 [04:14<06:30, 15.62s/it]                                                                                    [I 2025-10-06 09:43:25,138] Trial 21 finished with value: 129.7083642855194 and parameters: {'n1': 448, 'n2': 192, 'do1': 0.40788846054725514, 'do2': 0.35657711633980543, 'lr': 0.002943045606835861, 'l2': 0.00015593203026677776, 'act': 'gelu', 'batch': 512, 'epochs': 41}. Best is trial 21 with value: 129.7083642855194.
Best trial: 15. Best value: 130.071:  38%|███▊      | 15/40 [04:23<06:30, 15.62s/it]Best trial: 21. Best value: 129.708:  38%|███▊      | 15/40 [04:23<06:30, 15.62s/it]Best trial: 21. Best value: 129.708:  40%|████      | 16/40 [04:23<05:27, 13.65s/it]                                                                                    [I 2025-10-06 09:43:34,713] Trial 22 finished with value: 129.73011348083375 and parameters: {'n1': 448, 'n2': 192, 'do1': 0.4072864107188855, 'do2': 0.35073734307890286, 'lr': 0.0025152679446348775, 'l2': 0.00017909590801852682, 'act': 'gelu', 'batch': 512, 'epochs': 40}. Best is trial 21 with value: 129.7083642855194.
Best trial: 21. Best value: 129.708:  40%|████      | 16/40 [04:33<05:27, 13.65s/it]Best trial: 21. Best value: 129.708:  40%|████      | 16/40 [04:33<05:27, 13.65s/it]Best trial: 21. Best value: 129.708:  42%|████▎     | 17/40 [04:33<04:45, 12.42s/it]                                                                                    [I 2025-10-06 09:43:44,055] Trial 23 finished with value: 129.8747518645368 and parameters: {'n1': 448, 'n2': 192, 'do1': 0.4015213766548885, 'do2': 0.3510113145457912, 'lr': 0.0030396440209518273, 'l2': 0.00023472276540727506, 'act': 'gelu', 'batch': 512, 'epochs': 54}. Best is trial 21 with value: 129.7083642855194.
Best trial: 21. Best value: 129.708:  42%|████▎     | 17/40 [04:42<04:45, 12.42s/it]Best trial: 21. Best value: 129.708:  42%|████▎     | 17/40 [04:42<04:45, 12.42s/it]Best trial: 21. Best value: 129.708:  45%|████▌     | 18/40 [04:42<04:12, 11.50s/it]                                                                                    [I 2025-10-06 09:43:52,063] Trial 24 finished with value: 130.16999102135637 and parameters: {'n1': 384, 'n2': 128, 'do1': 0.41167491706788545, 'do2': 0.2108726115100513, 'lr': 0.002852224983296068, 'l2': 0.000977783530336048, 'act': 'gelu', 'batch': 512, 'epochs': 51}. Best is trial 21 with value: 129.7083642855194.
Best trial: 21. Best value: 129.708:  45%|████▌     | 18/40 [04:50<04:12, 11.50s/it]Best trial: 21. Best value: 129.708:  45%|████▌     | 18/40 [04:50<04:12, 11.50s/it]Best trial: 21. Best value: 129.708:  48%|████▊     | 19/40 [04:50<03:39, 10.45s/it]                                                                                    [I 2025-10-06 09:43:59,710] Trial 25 finished with value: 129.9693774029098 and parameters: {'n1': 256, 'n2': 128, 'do1': 0.42595421601238204, 'do2': 0.3501191485755071, 'lr': 0.0025698478297002357, 'l2': 0.000244804790439247, 'act': 'gelu', 'batch': 512, 'epochs': 55}. Best is trial 21 with value: 129.7083642855194.
Best trial: 21. Best value: 129.708:  48%|████▊     | 19/40 [04:58<03:39, 10.45s/it]Best trial: 21. Best value: 129.708:  48%|████▊     | 19/40 [04:58<03:39, 10.45s/it]Best trial: 21. Best value: 129.708:  50%|█████     | 20/40 [04:58<03:12,  9.61s/it]                                                                                    [I 2025-10-06 09:44:10,470] Trial 26 finished with value: 129.9924351765325 and parameters: {'n1': 512, 'n2': 256, 'do1': 0.3552148184511737, 'do2': 0.44358493834571333, 'lr': 0.004227590966211708, 'l2': 0.000237690844169047, 'act': 'gelu', 'batch': 512, 'epochs': 52}. Best is trial 21 with value: 129.7083642855194.
Best trial: 21. Best value: 129.708:  50%|█████     | 20/40 [05:09<03:12,  9.61s/it]Best trial: 21. Best value: 129.708:  50%|█████     | 20/40 [05:09<03:12,  9.61s/it]Best trial: 21. Best value: 129.708:  52%|█████▎    | 21/40 [05:09<03:09,  9.95s/it]                                                                                    [I 2025-10-06 09:44:19,869] Trial 27 finished with value: 129.74044100144718 and parameters: {'n1': 320, 'n2': 128, 'do1': 0.44481676287841676, 'do2': 0.21884835485945495, 'lr': 0.0022906271278912986, 'l2': 9.521062038625787e-06, 'act': 'gelu', 'batch': 512, 'epochs': 41}. Best is trial 21 with value: 129.7083642855194.
Best trial: 21. Best value: 129.708:  52%|█████▎    | 21/40 [05:18<03:09,  9.95s/it]Best trial: 21. Best value: 129.708:  52%|█████▎    | 21/40 [05:18<03:09,  9.95s/it]Best trial: 21. Best value: 129.708:  55%|█████▌    | 22/40 [05:18<02:56,  9.79s/it]                                                                                    [I 2025-10-06 09:44:28,684] Trial 28 finished with value: 129.93756764067504 and parameters: {'n1': 320, 'n2': 128, 'do1': 0.435205423974946, 'do2': 0.208525818851532, 'lr': 0.0022319720276003725, 'l2': 1.2505311737536462e-05, 'act': 'gelu', 'batch': 512, 'epochs': 41}. Best is trial 21 with value: 129.7083642855194.
Best trial: 21. Best value: 129.708:  55%|█████▌    | 22/40 [05:27<02:56,  9.79s/it]Best trial: 21. Best value: 129.708:  55%|█████▌    | 22/40 [05:27<02:56,  9.79s/it]Best trial: 21. Best value: 129.708:  57%|█████▊    | 23/40 [05:27<02:41,  9.50s/it]                                                                                    [I 2025-10-06 09:44:31,963] Trial 29 pruned. Trial was pruned at epoch 5.
Best trial: 21. Best value: 129.708:  57%|█████▊    | 23/40 [05:30<02:41,  9.50s/it]Best trial: 21. Best value: 129.708:  57%|█████▊    | 23/40 [05:30<02:41,  9.50s/it]Best trial: 21. Best value: 129.708:  60%|██████    | 24/40 [05:30<02:02,  7.63s/it]                                                                                    [I 2025-10-06 09:44:40,959] Trial 30 finished with value: 129.78481288752548 and parameters: {'n1': 384, 'n2': 160, 'do1': 0.3777784645200089, 'do2': 0.30088496175063717, 'lr': 0.004812703043521337, 'l2': 1.4883924743643942e-05, 'act': 'gelu', 'batch': 512, 'epochs': 62}. Best is trial 21 with value: 129.7083642855194.
Best trial: 21. Best value: 129.708:  60%|██████    | 24/40 [05:39<02:02,  7.63s/it]Best trial: 21. Best value: 129.708:  60%|██████    | 24/40 [05:39<02:02,  7.63s/it]Best trial: 21. Best value: 129.708:  62%|██████▎   | 25/40 [05:39<02:00,  8.04s/it]                                                                                    [I 2025-10-06 09:44:48,087] Trial 31 finished with value: 129.9957030539856 and parameters: {'n1': 256, 'n2': 64, 'do1': 0.34161378584919894, 'do2': 0.292357878596846, 'lr': 0.0035394631561635097, 'l2': 5.8145426031110536e-05, 'act': 'gelu', 'batch': 512, 'epochs': 46}. Best is trial 21 with value: 129.7083642855194.
Best trial: 21. Best value: 129.708:  62%|██████▎   | 25/40 [05:46<02:00,  8.04s/it]Best trial: 21. Best value: 129.708:  62%|██████▎   | 25/40 [05:46<02:00,  8.04s/it]Best trial: 21. Best value: 129.708:  65%|██████▌   | 26/40 [05:46<01:48,  7.77s/it]                                                                                    [I 2025-10-06 09:44:56,114] Trial 32 finished with value: 129.6991561026902 and parameters: {'n1': 384, 'n2': 160, 'do1': 0.37294085185940923, 'do2': 0.29172869700977455, 'lr': 0.004763717990181229, 'l2': 7.275111101829076e-06, 'act': 'gelu', 'batch': 512, 'epochs': 64}. Best is trial 32 with value: 129.6991561026902.
