Best trial: 4. Best value: 131.542:  37%|███▋      | 13/35 [13:31<14:34, 39.73s/it]Best trial: 13. Best value: 130.575:  37%|███▋      | 13/35 [13:31<14:34, 39.73s/it]Best trial: 13. Best value: 130.575:  40%|████      | 14/35 [13:31<12:43, 36.36s/it]                                                                                    [I 2025-10-06 10:18:48,690] Trial 14 finished with value: 131.1730801388951 and parameters: {'seq_len': 18, 'units': 96, 'dropout': 0.3495255694148705, 'lr': 0.002716732677869539, 'batch': 128, 'epochs': 81}. Best is trial 13 with value: 130.5752821052859.
Best trial: 13. Best value: 130.575:  40%|████      | 14/35 [13:54<12:43, 36.36s/it]Best trial: 13. Best value: 130.575:  40%|████      | 14/35 [13:54<12:43, 36.36s/it]Best trial: 13. Best value: 130.575:  43%|████▎     | 15/35 [13:54<10:45, 32.30s/it]                                                                                    [I 2025-10-06 10:19:13,935] Trial 15 finished with value: 131.03726062412554 and parameters: {'seq_len': 18, 'units': 96, 'dropout': 0.36708884144982235, 'lr': 0.0015665605271650445, 'batch': 256, 'epochs': 75}. Best is trial 13 with value: 130.5752821052859.
Best trial: 13. Best value: 130.575:  43%|████▎     | 15/35 [14:19<10:45, 32.30s/it]Best trial: 13. Best value: 130.575:  43%|████▎     | 15/35 [14:19<10:45, 32.30s/it]Best trial: 13. Best value: 130.575:  46%|████▌     | 16/35 [14:19<09:33, 30.18s/it]                                                                                    [I 2025-10-06 10:19:19,116] Trial 16 pruned. Trial was pruned at epoch 5.
Best trial: 13. Best value: 130.575:  46%|████▌     | 16/35 [14:24<09:33, 30.18s/it]Best trial: 13. Best value: 130.575:  46%|████▌     | 16/35 [14:24<09:33, 30.18s/it]Best trial: 13. Best value: 130.575:  49%|████▊     | 17/35 [14:24<06:47, 22.66s/it]                                                                                    [I 2025-10-06 10:19:51,396] Trial 17 finished with value: 131.36095756302555 and parameters: {'seq_len': 18, 'units': 96, 'dropout': 0.29646127647197906, 'lr': 0.0010399853318106785, 'batch': 256, 'epochs': 75}. Best is trial 13 with value: 130.5752821052859.
Best trial: 13. Best value: 130.575:  49%|████▊     | 17/35 [14:56<06:47, 22.66s/it]Best trial: 13. Best value: 130.575:  49%|████▊     | 17/35 [14:56<06:47, 22.66s/it]Best trial: 13. Best value: 130.575:  51%|█████▏    | 18/35 [14:56<07:14, 25.55s/it]                                                                                    [I 2025-10-06 10:19:56,708] Trial 18 pruned. Trial was pruned at epoch 5.
Best trial: 13. Best value: 130.575:  51%|█████▏    | 18/35 [15:02<07:14, 25.55s/it]Best trial: 13. Best value: 130.575:  51%|█████▏    | 18/35 [15:02<07:14, 25.55s/it]Best trial: 13. Best value: 130.575:  54%|█████▍    | 19/35 [15:02<05:11, 19.47s/it]                                                                                    [I 2025-10-06 10:20:19,650] Trial 19 finished with value: 131.27193269126496 and parameters: {'seq_len': 18, 'units': 96, 'dropout': 0.335815707793091, 'lr': 0.0023502585100243973, 'batch': 256, 'epochs': 57}. Best is trial 13 with value: 130.5752821052859.
Best trial: 13. Best value: 130.575:  54%|█████▍    | 19/35 [15:25<05:11, 19.47s/it]Best trial: 13. Best value: 130.575:  54%|█████▍    | 19/35 [15:25<05:11, 19.47s/it]Best trial: 13. Best value: 130.575:  57%|█████▋    | 20/35 [15:25<05:07, 20.51s/it]                                                                                    [I 2025-10-06 10:20:25,625] Trial 20 pruned. Trial was pruned at epoch 5.
Best trial: 13. Best value: 130.575:  57%|█████▋    | 20/35 [15:31<05:07, 20.51s/it]Best trial: 13. Best value: 130.575:  57%|█████▋    | 20/35 [15:31<05:07, 20.51s/it]Best trial: 13. Best value: 130.575:  60%|██████    | 21/35 [15:31<03:46, 16.15s/it]                                                                                    [I 2025-10-06 10:21:01,134] Trial 21 finished with value: 130.51208486908405 and parameters: {'seq_len': 18, 'units': 96, 'dropout': 0.3524970769007811, 'lr': 0.0026981873214480786, 'batch': 128, 'epochs': 79}. Best is trial 21 with value: 130.51208486908405.
Best trial: 13. Best value: 130.575:  60%|██████    | 21/35 [16:06<03:46, 16.15s/it]Best trial: 21. Best value: 130.512:  60%|██████    | 21/35 [16:06<03:46, 16.15s/it]Best trial: 21. Best value: 130.512:  63%|██████▎   | 22/35 [16:06<04:45, 21.96s/it]                                                                                    [I 2025-10-06 10:21:28,056] Trial 22 finished with value: 131.4509993662087 and parameters: {'seq_len': 18, 'units': 96, 'dropout': 0.3676734952597942, 'lr': 0.002901586796154443, 'batch': 128, 'epochs': 95}. Best is trial 21 with value: 130.51208486908405.
Best trial: 21. Best value: 130.512:  63%|██████▎   | 22/35 [16:33<04:45, 21.96s/it]Best trial: 21. Best value: 130.512:  63%|██████▎   | 22/35 [16:33<04:45, 21.96s/it]Best trial: 21. Best value: 130.512:  66%|██████▌   | 23/35 [16:33<04:41, 23.45s/it]                                                                                    [I 2025-10-06 10:22:10,317] Trial 23 finished with value: 131.35796898408944 and parameters: {'seq_len': 18, 'units': 96, 'dropout': 0.3186751381161097, 'lr': 0.0016460183337506722, 'batch': 64, 'epochs': 74}. Best is trial 21 with value: 130.51208486908405.
Best trial: 21. Best value: 130.512:  66%|██████▌   | 23/35 [17:15<04:41, 23.45s/it]Best trial: 21. Best value: 130.512:  66%|██████▌   | 23/35 [17:15<04:41, 23.45s/it]Best trial: 21. Best value: 130.512:  69%|██████▊   | 24/35 [17:15<05:20, 29.09s/it]                                                                                    [I 2025-10-06 10:22:43,333] Trial 24 finished with value: 130.91146071629862 and parameters: {'seq_len': 18, 'units': 128, 'dropout': 0.3993649987622624, 'lr': 0.002799385553124246, 'batch': 128, 'epochs': 59}. Best is trial 21 with value: 130.51208486908405.
Best trial: 21. Best value: 130.512:  69%|██████▊   | 24/35 [17:48<05:20, 29.09s/it]Best trial: 21. Best value: 130.512:  69%|██████▊   | 24/35 [17:48<05:20, 29.09s/it]Best trial: 21. Best value: 130.512:  71%|███████▏  | 25/35 [17:48<05:02, 30.27s/it]                                                                                    [I 2025-10-06 10:23:10,420] Trial 25 finished with value: 131.13967089042887 and parameters: {'seq_len': 18, 'units': 128, 'dropout': 0.39849015376209823, 'lr': 0.003073275891214319, 'batch': 128, 'epochs': 59}. Best is trial 21 with value: 130.51208486908405.
Best trial: 21. Best value: 130.512:  71%|███████▏  | 25/35 [18:15<05:02, 30.27s/it]Best trial: 21. Best value: 130.512:  71%|███████▏  | 25/35 [18:15<05:02, 30.27s/it]Best trial: 21. Best value: 130.512:  74%|███████▍  | 26/35 [18:15<04:23, 29.32s/it]                                                                                    [I 2025-10-06 10:23:20,056] Trial 26 pruned. Trial was pruned at epoch 5.
Best trial: 21. Best value: 130.512:  74%|███████▍  | 26/35 [18:25<04:23, 29.32s/it]Best trial: 21. Best value: 130.512:  74%|███████▍  | 26/35 [18:25<04:23, 29.32s/it]Best trial: 21. Best value: 130.512:  77%|███████▋  | 27/35 [18:25<03:07, 23.41s/it]                                                                                    [I 2025-10-06 10:23:47,164] Trial 27 finished with value: 130.7773184892931 and parameters: {'seq_len': 18, 'units': 128, 'dropout': 0.3050670946090331, 'lr': 0.0022076939977520825, 'batch': 128, 'epochs': 51}. Best is trial 21 with value: 130.51208486908405.
Best trial: 21. Best value: 130.512:  77%|███████▋  | 27/35 [18:52<03:07, 23.41s/it]Best trial: 21. Best value: 130.512:  77%|███████▋  | 27/35 [18:52<03:07, 23.41s/it]Best trial: 21. Best value: 130.512:  80%|████████  | 28/35 [18:52<02:51, 24.52s/it]                                                                                    [I 2025-10-06 10:24:17,429] Trial 28 finished with value: 131.21002367387942 and parameters: {'seq_len': 24, 'units': 128, 'dropout': 0.2951664053859999, 'lr': 0.0021325297823448644, 'batch': 128, 'epochs': 52}. Best is trial 21 with value: 130.51208486908405.
Best trial: 21. Best value: 130.512:  80%|████████  | 28/35 [19:22<02:51, 24.52s/it]Best trial: 21. Best value: 130.512:  80%|████████  | 28/35 [19:22<02:51, 24.52s/it]Best trial: 21. Best value: 130.512:  83%|████████▎ | 29/35 [19:22<02:37, 26.24s/it]                                                                                    [I 2025-10-06 10:24:30,059] Trial 29 pruned. Trial was pruned at epoch 5.
Best trial: 21. Best value: 130.512:  83%|████████▎ | 29/35 [19:35<02:37, 26.24s/it]Best trial: 21. Best value: 130.512:  83%|████████▎ | 29/35 [19:35<02:37, 26.24s/it]Best trial: 21. Best value: 130.512:  86%|████████▌ | 30/35 [19:35<01:50, 22.16s/it]                                                                                    [I 2025-10-06 10:24:38,153] Trial 30 pruned. Trial was pruned at epoch 5.
Best trial: 21. Best value: 130.512:  86%|████████▌ | 30/35 [19:43<01:50, 22.16s/it]Best trial: 21. Best value: 130.512:  86%|████████▌ | 30/35 [19:43<01:50, 22.16s/it]Best trial: 21. Best value: 130.512:  89%|████████▊ | 31/35 [19:43<01:11, 17.94s/it]                                                                                    [I 2025-10-06 10:25:04,069] Trial 31 finished with value: 131.20332503408594 and parameters: {'seq_len': 18, 'units': 128, 'dropout': 0.3739226478676664, 'lr': 0.003136281158953299, 'batch': 128, 'epochs': 55}. Best is trial 21 with value: 130.51208486908405.
Best trial: 21. Best value: 130.512:  89%|████████▊ | 31/35 [20:09<01:11, 17.94s/it]Best trial: 21. Best value: 130.512:  89%|████████▊ | 31/35 [20:09<01:11, 17.94s/it]Best trial: 21. Best value: 130.512:  91%|█████████▏| 32/35 [20:09<01:00, 20.33s/it]                                                                                    [I 2025-10-06 10:25:13,141] Trial 32 pruned. Trial was pruned at epoch 5.
Best trial: 21. Best value: 130.512:  91%|█████████▏| 32/35 [20:18<01:00, 20.33s/it]Best trial: 21. Best value: 130.512:  91%|█████████▏| 32/35 [20:18<01:00, 20.33s/it]Best trial: 21. Best value: 130.512:  94%|█████████▍| 33/35 [20:18<00:33, 16.95s/it]                                                                                    [I 2025-10-06 10:25:21,811] Trial 33 pruned. Trial was pruned at epoch 5.
Best trial: 21. Best value: 130.512:  94%|█████████▍| 33/35 [20:27<00:33, 16.95s/it]Best trial: 21. Best value: 130.512:  94%|█████████▍| 33/35 [20:27<00:33, 16.95s/it]Best trial: 21. Best value: 130.512:  97%|█████████▋| 34/35 [20:27<00:14, 14.47s/it]                                                                                    [I 2025-10-06 10:25:30,796] Trial 34 pruned. Trial was pruned at epoch 5.
Best trial: 21. Best value: 130.512:  97%|█████████▋| 34/35 [20:36<00:14, 14.47s/it]Best trial: 21. Best value: 130.512:  97%|█████████▋| 34/35 [20:36<00:14, 14.47s/it]Best trial: 21. Best value: 130.512: 100%|██████████| 35/35 [20:36<00:00, 12.82s/it]Best trial: 21. Best value: 130.512: 100%|██████████| 35/35 [20:36<00:00, 35.32s/it]
/home/e.ladino/miniconda3/envs/e_ladino/lib/python3.12/site-packages/keras/src/saving/saving_lib.py:797: UserWarning: Skipping variable loading for optimizer 'adam', because it has 2 variables whereas the saved optimizer has 18 variables. 
  saveable.load_own_variables(weights_store.get(inner_path))
Best BiLSTM params: {'seq_len': 18, 'units': 96, 'dropout': 0.3524970769007811, 'lr': 0.0026981873214480786, 'batch': 128, 'epochs': 79}
BiLSTM test → RMSE: 136.8247 | MAE: 70.5807 | R2: 0.7180 | Skill: 0.303
/mnt/SOLARLAB/E_Ladino/Repo/irradiance-fusion-forecast/Notebooks/05_ground_hpo_optuna_v1.py:141: FutureWarning: The import path :class:`~optuna.storages.JournalFileOpenLock` has been deprecated in v4.0.0. This feature will be removed in v6.0.0. See https://github.com/optuna/optuna/releases/tag/v4.0.0. Use :class:`~optuna.storages.journal.JournalFileOpenLock` instead.
  file_storage = JournalFileStorage(str(log_path), lock_obj=JournalFileOpenLock(str(lock_path)))
/mnt/SOLARLAB/E_Ladino/Repo/irradiance-fusion-forecast/Notebooks/05_ground_hpo_optuna_v1.py:141: FutureWarning: JournalFileStorage has been deprecated in v4.0.0. This feature will be removed in v6.0.0. See https://github.com/optuna/optuna/releases/tag/v4.0.0. Use :class:`~optuna.storages.journal.JournalFileBackend` instead.
  file_storage = JournalFileStorage(str(log_path), lock_obj=JournalFileOpenLock(str(lock_path)))
[I 2025-10-06 10:25:31,658] A new study created in Journal with name: ground_trackB_cnnlstm
Running Study B3 (CNN-LSTM)…
  0%|          | 0/35 [00:00<?, ?it/s]                                      [I 2025-10-06 10:26:15,738] Trial 0 finished with value: 135.9258543862241 and parameters: {'seq_len': 12, 'filters': 16, 'kernel_size': 5, 'pool': 2, 'lstm_units': 32, 'dropout': 0.38796394086479774, 'lr': 0.002311294500510415, 'batch': 64, 'epochs': 64}. Best is trial 0 with value: 135.9258543862241.
  0%|          | 0/35 [00:44<?, ?it/s]Best trial: 0. Best value: 135.926:   0%|          | 0/35 [00:44<?, ?it/s]Best trial: 0. Best value: 135.926:   3%|▎         | 1/35 [00:44<24:58, 44.08s/it]                                                                                  [I 2025-10-06 10:29:24,574] Trial 1 finished with value: 137.70820174602892 and parameters: {'seq_len': 24, 'filters': 16, 'kernel_size': 5, 'pool': 1, 'lstm_units': 96, 'dropout': 0.236965827544817, 'lr': 6.192568649430468e-05, 'batch': 64, 'epochs': 116}. Best is trial 0 with value: 135.9258543862241.
Best trial: 0. Best value: 135.926:   3%|▎         | 1/35 [03:52<24:58, 44.08s/it]Best trial: 0. Best value: 135.926:   3%|▎         | 1/35 [03:52<24:58, 44.08s/it]Best trial: 0. Best value: 135.926:   6%|▌         | 2/35 [03:52<1:11:04, 129.23s/it]                                                                                     [I 2025-10-06 10:30:54,578] Trial 2 finished with value: 133.19678962206635 and parameters: {'seq_len': 6, 'filters': 48, 'kernel_size': 5, 'pool': 2, 'lstm_units': 64, 'dropout': 0.2650089137415928, 'lr': 0.00021008360271862668, 'batch': 128, 'epochs': 118}. Best is trial 2 with value: 133.19678962206635.
Best trial: 0. Best value: 135.926:   6%|▌         | 2/35 [05:22<1:11:04, 129.23s/it]Best trial: 2. Best value: 133.197:   6%|▌         | 2/35 [05:22<1:11:04, 129.23s/it]Best trial: 2. Best value: 133.197:   9%|▊         | 3/35 [05:22<59:22, 111.32s/it]                                                                                     [I 2025-10-06 10:32:17,957] Trial 3 finished with value: 136.32550230285236 and parameters: {'seq_len': 12, 'filters': 64, 'kernel_size': 3, 'pool': 2, 'lstm_units': 64, 'dropout': 0.3314950036607718, 'lr': 0.0002585095893183495, 'batch': 128, 'epochs': 104}. Best is trial 2 with value: 133.19678962206635.
Best trial: 2. Best value: 133.197:   9%|▊         | 3/35 [06:46<59:22, 111.32s/it]Best trial: 2. Best value: 133.197:   9%|▊         | 3/35 [06:46<59:22, 111.32s/it]Best trial: 2. Best value: 133.197:  11%|█▏        | 4/35 [06:46<51:48, 100.29s/it]                                                                                   [I 2025-10-06 10:32:50,399] Trial 4 finished with value: 132.69245309879156 and parameters: {'seq_len': 12, 'filters': 16, 'kernel_size': 2, 'pool': 1, 'lstm_units': 64, 'dropout': 0.04634762381005189, 'lr': 0.002661808797375751, 'batch': 64, 'epochs': 65}. Best is trial 4 with value: 132.69245309879156.
Best trial: 2. Best value: 133.197:  11%|█▏        | 4/35 [07:18<51:48, 100.29s/it]Best trial: 4. Best value: 132.692:  11%|█▏        | 4/35 [07:18<51:48, 100.29s/it]Best trial: 4. Best value: 132.692:  14%|█▍        | 5/35 [07:18<37:54, 75.82s/it]                                                                                   [I 2025-10-06 10:34:04,846] Trial 5 finished with value: 135.18172086584045 and parameters: {'seq_len': 24, 'filters': 32, 'kernel_size': 5, 'pool': 2, 'lstm_units': 64, 'dropout': 0.20909313175279765, 'lr': 0.00035813934999486707, 'batch': 128, 'epochs': 91}. Best is trial 4 with value: 132.69245309879156.
Best trial: 4. Best value: 132.692:  14%|█▍        | 5/35 [08:33<37:54, 75.82s/it]Best trial: 4. Best value: 132.692:  14%|█▍        | 5/35 [08:33<37:54, 75.82s/it]Best trial: 4. Best value: 132.692:  17%|█▋        | 6/35 [08:33<36:25, 75.35s/it]                                                                                  [I 2025-10-06 10:34:52,441] Trial 6 finished with value: 132.07209057698375 and parameters: {'seq_len': 18, 'filters': 32, 'kernel_size': 2, 'pool': 1, 'lstm_units': 128, 'dropout': 0.3232481518257668, 'lr': 0.000924224586049431, 'batch': 64, 'epochs': 112}. Best is trial 6 with value: 132.07209057698375.
Best trial: 4. Best value: 132.692:  17%|█▋        | 6/35 [09:20<36:25, 75.35s/it]Best trial: 6. Best value: 132.072:  17%|█▋        | 6/35 [09:20<36:25, 75.35s/it]Best trial: 6. Best value: 132.072:  20%|██        | 7/35 [09:20<30:55, 66.28s/it]                                                                                  [I 2025-10-06 10:35:37,404] Trial 7 finished with value: 206.25314391543222 and parameters: {'seq_len': 18, 'filters': 16, 'kernel_size': 5, 'pool': 1, 'lstm_units': 96, 'dropout': 0.16696440125951162, 'lr': 0.0001390546848963277, 'batch': 256, 'epochs': 66}. Best is trial 6 with value: 132.07209057698375.
Best trial: 6. Best value: 132.072:  20%|██        | 7/35 [10:05<30:55, 66.28s/it]Best trial: 6. Best value: 132.072:  20%|██        | 7/35 [10:05<30:55, 66.28s/it]Best trial: 6. Best value: 132.072:  23%|██▎       | 8/35 [10:05<26:46, 59.49s/it]                                                                                  [I 2025-10-06 10:35:46,510] Trial 8 pruned. Trial was pruned at epoch 5.
Best trial: 6. Best value: 132.072:  23%|██▎       | 8/35 [10:14<26:46, 59.49s/it]Best trial: 6. Best value: 132.072:  23%|██▎       | 8/35 [10:14<26:46, 59.49s/it]Best trial: 6. Best value: 132.072:  26%|██▌       | 9/35 [10:14<18:57, 43.74s/it]                                                                                  [I 2025-10-06 10:36:22,602] Trial 9 finished with value: 132.73093819123332 and parameters: {'seq_len': 12, 'filters': 64, 'kernel_size': 3, 'pool': 2, 'lstm_units': 96, 'dropout': 0.03611590802176332, 'lr': 0.0023419358540593647, 'batch': 64, 'epochs': 87}. Best is trial 6 with value: 132.07209057698375.
Best trial: 6. Best value: 132.072:  26%|██▌       | 9/35 [10:50<18:57, 43.74s/it]Best trial: 6. Best value: 132.072:  26%|██▌       | 9/35 [10:50<18:57, 43.74s/it]Best trial: 6. Best value: 132.072:  29%|██▊       | 10/35 [10:50<17:14, 41.38s/it]                                                                                   [I 2025-10-06 10:37:03,803] Trial 10 finished with value: 133.38175064921737 and parameters: {'seq_len': 18, 'filters': 32, 'kernel_size': 2, 'pool': 1, 'lstm_units': 128, 'dropout': 0.3208799472720689, 'lr': 0.0008200741601320914, 'batch': 256, 'epochs': 100}. Best is trial 6 with value: 132.07209057698375.
Best trial: 6. Best value: 132.072:  29%|██▊       | 10/35 [11:32<17:14, 41.38s/it]Best trial: 6. Best value: 132.072:  29%|██▊       | 10/35 [11:32<17:14, 41.38s/it]Best trial: 6. Best value: 132.072:  31%|███▏      | 11/35 [11:32<16:31, 41.33s/it]                                                                                   [I 2025-10-06 10:37:41,308] Trial 11 finished with value: 131.05451215524783 and parameters: {'seq_len': 18, 'filters': 32, 'kernel_size': 2, 'pool': 1, 'lstm_units': 128, 'dropout': 0.02712810710504837, 'lr': 0.0009191014050706828, 'batch': 64, 'epochs': 75}. Best is trial 11 with value: 131.05451215524783.
Best trial: 6. Best value: 132.072:  31%|███▏      | 11/35 [12:09<16:31, 41.33s/it]Best trial: 11. Best value: 131.055:  31%|███▏      | 11/35 [12:09<16:31, 41.33s/it]Best trial: 11. Best value: 131.055:  34%|███▍      | 12/35 [12:09<15:23, 40.16s/it]                                                                                    [I 2025-10-06 10:38:17,866] Trial 12 finished with value: 131.81511525380918 and parameters: {'seq_len': 18, 'filters': 32, 'kernel_size': 2, 'pool': 1, 'lstm_units': 128, 'dropout': 0.11800943075598573, 'lr': 0.0009000277393655389, 'batch': 64, 'epochs': 76}. Best is trial 11 with value: 131.05451215524783.
Best trial: 11. Best value: 131.055:  34%|███▍      | 12/35 [12:46<15:23, 40.16s/it]Best trial: 11. Best value: 131.055:  34%|███▍      | 12/35 [12:46<15:23, 40.16s/it]Best trial: 11. Best value: 131.055:  37%|███▋      | 13/35 [12:46<14:19, 39.07s/it]                                                                                    [I 2025-10-06 10:38:54,289] Trial 13 finished with value: 131.3946375665689 and parameters: {'seq_len': 18, 'filters': 48, 'kernel_size': 2, 'pool': 1, 'lstm_units': 128, 'dropout': 0.10858005715109262, 'lr': 0.0009311434837451578, 'batch': 64, 'epochs': 77}. Best is trial 11 with value: 131.05451215524783.
Best trial: 11. Best value: 131.055:  37%|███▋      | 13/35 [13:22<14:19, 39.07s/it]Best trial: 11. Best value: 131.055:  37%|███▋      | 13/35 [13:22<14:19, 39.07s/it]Best trial: 11. Best value: 131.055:  40%|████      | 14/35 [13:22<13:23, 38.27s/it]                                                                                    [I 2025-10-06 10:39:28,867] Trial 14 finished with value: 131.24534217925603 and parameters: {'seq_len': 18, 'filters': 48, 'kernel_size': 2, 'pool': 1, 'lstm_units': 128, 'dropout': 0.10289531425438014, 'lr': 0.0013339821465659144, 'batch': 64, 'epochs': 77}. Best is trial 11 with value: 131.05451215524783.
