Best trial: 15. Best value: 131.247:  42%|████▎     | 17/40 [07:23<07:08, 18.64s/it]Best trial: 15. Best value: 131.247:  42%|████▎     | 17/40 [07:23<07:08, 18.64s/it]Best trial: 15. Best value: 131.247:  45%|████▌     | 18/40 [07:23<07:41, 20.98s/it]                                                                                    [I 2025-10-06 10:54:25,066] Trial 18 finished with value: 131.29645011385495 and parameters: {'seq_len': 24, 'd_model': 32, 'heads': 2, 'ff_dim': 96, 'att_dropout': 0.08836097952378665, 'dropout': 0.17931246566649828, 'lr': 0.0006618428327118367, 'batch': 64, 'epochs': 79}. Best is trial 15 with value: 131.24691216605822.
Best trial: 15. Best value: 131.247:  45%|████▌     | 18/40 [07:45<07:41, 20.98s/it]Best trial: 15. Best value: 131.247:  45%|████▌     | 18/40 [07:45<07:41, 20.98s/it]Best trial: 15. Best value: 131.247:  48%|████▊     | 19/40 [07:45<07:27, 21.29s/it]                                                                                    [I 2025-10-06 10:54:43,541] Trial 19 finished with value: 132.80544098887665 and parameters: {'seq_len': 24, 'd_model': 32, 'heads': 2, 'ff_dim': 96, 'att_dropout': 0.01623717352457832, 'dropout': 0.1752756366757143, 'lr': 0.0007043211741023973, 'batch': 64, 'epochs': 62}. Best is trial 15 with value: 131.24691216605822.
Best trial: 15. Best value: 131.247:  48%|████▊     | 19/40 [08:03<07:27, 21.29s/it]Best trial: 15. Best value: 131.247:  48%|████▊     | 19/40 [08:03<07:27, 21.29s/it]Best trial: 15. Best value: 131.247:  50%|█████     | 20/40 [08:03<06:48, 20.45s/it]                                                                                    [I 2025-10-06 10:55:04,314] Trial 20 finished with value: 132.32081043811664 and parameters: {'seq_len': 24, 'd_model': 32, 'heads': 2, 'ff_dim': 96, 'att_dropout': 0.0888063652940661, 'dropout': 0.22833995475020158, 'lr': 0.0021349505879704983, 'batch': 64, 'epochs': 76}. Best is trial 15 with value: 131.24691216605822.
Best trial: 15. Best value: 131.247:  50%|█████     | 20/40 [08:24<06:48, 20.45s/it]Best trial: 15. Best value: 131.247:  50%|█████     | 20/40 [08:24<06:48, 20.45s/it]Best trial: 15. Best value: 131.247:  52%|█████▎    | 21/40 [08:24<06:30, 20.54s/it]                                                                                    [I 2025-10-06 10:55:14,488] Trial 21 pruned. Trial was pruned at epoch 5.
Best trial: 15. Best value: 131.247:  52%|█████▎    | 21/40 [08:34<06:30, 20.54s/it]Best trial: 15. Best value: 131.247:  52%|█████▎    | 21/40 [08:34<06:30, 20.54s/it]Best trial: 15. Best value: 131.247:  55%|█████▌    | 22/40 [08:34<05:13, 17.43s/it]                                                                                    [I 2025-10-06 10:55:32,205] Trial 22 finished with value: 133.16593414092435 and parameters: {'seq_len': 24, 'd_model': 32, 'heads': 2, 'ff_dim': 96, 'att_dropout': 0.07769040606047072, 'dropout': 0.24984405808045818, 'lr': 0.0012595484960449008, 'batch': 64, 'epochs': 88}. Best is trial 15 with value: 131.24691216605822.
Best trial: 15. Best value: 131.247:  55%|█████▌    | 22/40 [08:52<05:13, 17.43s/it]Best trial: 15. Best value: 131.247:  55%|█████▌    | 22/40 [08:52<05:13, 17.43s/it]Best trial: 15. Best value: 131.247:  57%|█████▊    | 23/40 [08:52<04:57, 17.52s/it]                                                                                    [I 2025-10-06 10:55:43,777] Trial 23 pruned. Trial was pruned at epoch 5.
Best trial: 15. Best value: 131.247:  57%|█████▊    | 23/40 [09:04<04:57, 17.52s/it]Best trial: 15. Best value: 131.247:  57%|█████▊    | 23/40 [09:04<04:57, 17.52s/it]Best trial: 15. Best value: 131.247:  60%|██████    | 24/40 [09:04<04:11, 15.73s/it]2025-10-06 10:55:48.630409: I external/local_xla/xla/stream_executor/cuda/cuda_asm_compiler.cc:397] ptxas warning : Registers are spilled to local memory in function 'gemm_fusion_dot_6', 8 bytes spill stores, 8 bytes spill loads

2025-10-06 10:55:50.206570: I external/local_xla/xla/stream_executor/cuda/cuda_asm_compiler.cc:397] ptxas warning : Registers are spilled to local memory in function 'gemm_fusion_dot_6', 8 bytes spill stores, 8 bytes spill loads

                                                                                    [I 2025-10-06 10:55:54,355] Trial 24 pruned. Trial was pruned at epoch 5.
Best trial: 15. Best value: 131.247:  60%|██████    | 24/40 [09:14<04:11, 15.73s/it]Best trial: 15. Best value: 131.247:  60%|██████    | 24/40 [09:14<04:11, 15.73s/it]Best trial: 15. Best value: 131.247:  62%|██████▎   | 25/40 [09:14<03:32, 14.19s/it]                                                                                    [I 2025-10-06 10:56:20,987] Trial 25 finished with value: 131.09412619135534 and parameters: {'seq_len': 24, 'd_model': 32, 'heads': 8, 'ff_dim': 96, 'att_dropout': 0.10376183724747076, 'dropout': 0.39708234871401904, 'lr': 0.0030434470617868273, 'batch': 64, 'epochs': 76}. Best is trial 25 with value: 131.09412619135534.
Best trial: 15. Best value: 131.247:  62%|██████▎   | 25/40 [09:41<03:32, 14.19s/it]Best trial: 25. Best value: 131.094:  62%|██████▎   | 25/40 [09:41<03:32, 14.19s/it]Best trial: 25. Best value: 131.094:  65%|██████▌   | 26/40 [09:41<04:10, 17.92s/it]                                                                                    [I 2025-10-06 10:56:50,968] Trial 26 finished with value: 130.92029272375999 and parameters: {'seq_len': 24, 'd_model': 32, 'heads': 8, 'ff_dim': 96, 'att_dropout': 0.10491772630248755, 'dropout': 0.3963910655147282, 'lr': 0.004827891115632173, 'batch': 64, 'epochs': 86}. Best is trial 26 with value: 130.92029272375999.
Best trial: 25. Best value: 131.094:  65%|██████▌   | 26/40 [10:11<04:10, 17.92s/it]Best trial: 26. Best value: 130.92:  65%|██████▌   | 26/40 [10:11<04:10, 17.92s/it] Best trial: 26. Best value: 130.92:  68%|██████▊   | 27/40 [10:11<04:40, 21.54s/it]                                                                                   [I 2025-10-06 10:57:17,120] Trial 27 finished with value: 131.8642842210316 and parameters: {'seq_len': 24, 'd_model': 32, 'heads': 8, 'ff_dim': 96, 'att_dropout': 0.11164659137078874, 'dropout': 0.3897925807482304, 'lr': 0.002900269517320141, 'batch': 64, 'epochs': 88}. Best is trial 26 with value: 130.92029272375999.
Best trial: 26. Best value: 130.92:  68%|██████▊   | 27/40 [10:37<04:40, 21.54s/it]Best trial: 26. Best value: 130.92:  68%|██████▊   | 27/40 [10:37<04:40, 21.54s/it]Best trial: 26. Best value: 130.92:  70%|███████   | 28/40 [10:37<04:35, 22.92s/it]                                                                                   [I 2025-10-06 10:57:32,536] Trial 28 finished with value: 132.03212647638074 and parameters: {'seq_len': 24, 'd_model': 32, 'heads': 8, 'ff_dim': 96, 'att_dropout': 0.13461081921414292, 'dropout': 0.39790831479379274, 'lr': 0.004930649328687814, 'batch': 128, 'epochs': 61}. Best is trial 26 with value: 130.92029272375999.
Best trial: 26. Best value: 130.92:  70%|███████   | 28/40 [10:52<04:35, 22.92s/it]Best trial: 26. Best value: 130.92:  70%|███████   | 28/40 [10:52<04:35, 22.92s/it]Best trial: 26. Best value: 130.92:  72%|███████▎  | 29/40 [10:52<03:47, 20.67s/it]                                                                                   [I 2025-10-06 10:57:41,156] Trial 29 pruned. Trial was pruned at epoch 5.
Best trial: 26. Best value: 130.92:  72%|███████▎  | 29/40 [11:01<03:47, 20.67s/it]Best trial: 26. Best value: 130.92:  72%|███████▎  | 29/40 [11:01<03:47, 20.67s/it]Best trial: 26. Best value: 130.92:  75%|███████▌  | 30/40 [11:01<02:50, 17.06s/it]                                                                                   [I 2025-10-06 10:57:50,367] Trial 30 pruned. Trial was pruned at epoch 5.
Best trial: 26. Best value: 130.92:  75%|███████▌  | 30/40 [11:10<02:50, 17.06s/it]Best trial: 26. Best value: 130.92:  75%|███████▌  | 30/40 [11:10<02:50, 17.06s/it]Best trial: 26. Best value: 130.92:  78%|███████▊  | 31/40 [11:10<02:12, 14.70s/it]                                                                                   [I 2025-10-06 10:58:25,442] Trial 31 finished with value: 131.42840553415385 and parameters: {'seq_len': 24, 'd_model': 32, 'heads': 8, 'ff_dim': 96, 'att_dropout': 0.09869286095696933, 'dropout': 0.3642262763012858, 'lr': 0.004965504495741866, 'batch': 64, 'epochs': 85}. Best is trial 26 with value: 130.92029272375999.
Best trial: 26. Best value: 130.92:  78%|███████▊  | 31/40 [11:45<02:12, 14.70s/it]Best trial: 26. Best value: 130.92:  78%|███████▊  | 31/40 [11:45<02:12, 14.70s/it]Best trial: 26. Best value: 130.92:  80%|████████  | 32/40 [11:45<02:46, 20.81s/it]                                                                                   [I 2025-10-06 10:58:43,713] Trial 32 finished with value: 131.52008669068385 and parameters: {'seq_len': 24, 'd_model': 32, 'heads': 8, 'ff_dim': 96, 'att_dropout': 0.08104985226686043, 'dropout': 0.3250936693024108, 'lr': 0.002011056295532721, 'batch': 64, 'epochs': 75}. Best is trial 26 with value: 130.92029272375999.
Best trial: 26. Best value: 130.92:  80%|████████  | 32/40 [12:04<02:46, 20.81s/it]Best trial: 26. Best value: 130.92:  80%|████████  | 32/40 [12:04<02:46, 20.81s/it]Best trial: 26. Best value: 130.92:  82%|████████▎ | 33/40 [12:04<02:20, 20.05s/it]                                                                                   [I 2025-10-06 10:59:05,649] Trial 33 finished with value: 132.19814525693997 and parameters: {'seq_len': 24, 'd_model': 32, 'heads': 8, 'ff_dim': 96, 'att_dropout': 0.10581120554073059, 'dropout': 0.15397043428862223, 'lr': 0.0033879973439587766, 'batch': 64, 'epochs': 82}. Best is trial 26 with value: 130.92029272375999.
Best trial: 26. Best value: 130.92:  82%|████████▎ | 33/40 [12:26<02:20, 20.05s/it]Best trial: 26. Best value: 130.92:  82%|████████▎ | 33/40 [12:26<02:20, 20.05s/it]Best trial: 26. Best value: 130.92:  85%|████████▌ | 34/40 [12:26<02:03, 20.62s/it]2025-10-06 10:59:08.783358: I external/local_xla/xla/stream_executor/cuda/cuda_asm_compiler.cc:397] ptxas warning : Registers are spilled to local memory in function 'gemm_fusion_dot_31', 52 bytes spill stores, 52 bytes spill loads

2025-10-06 10:59:08.801122: I external/local_xla/xla/stream_executor/cuda/cuda_asm_compiler.cc:397] ptxas warning : Registers are spilled to local memory in function 'gemm_fusion_dot_6', 52 bytes spill stores, 52 bytes spill loads

2025-10-06 10:59:08.819535: I external/local_xla/xla/stream_executor/cuda/cuda_asm_compiler.cc:397] ptxas warning : Registers are spilled to local memory in function 'gemm_fusion_dot_6', 56 bytes spill stores, 56 bytes spill loads

2025-10-06 10:59:08.928837: I external/local_xla/xla/stream_executor/cuda/cuda_asm_compiler.cc:397] ptxas warning : Registers are spilled to local memory in function 'gemm_fusion_dot_31', 56 bytes spill stores, 56 bytes spill loads

2025-10-06 10:59:12.358614: I external/local_xla/xla/stream_executor/cuda/cuda_asm_compiler.cc:397] ptxas warning : Registers are spilled to local memory in function 'input_add_multiply_reduce_fusion', 40 bytes spill stores, 24 bytes spill loads

                                                                                   [I 2025-10-06 10:59:40,217] Trial 34 finished with value: 131.57923735576597 and parameters: {'seq_len': 24, 'd_model': 96, 'heads': 8, 'ff_dim': 96, 'att_dropout': 0.029046932811349888, 'dropout': 0.2468791009878245, 'lr': 0.00247570667259, 'batch': 64, 'epochs': 74}. Best is trial 26 with value: 130.92029272375999.
Best trial: 26. Best value: 130.92:  85%|████████▌ | 34/40 [13:00<02:03, 20.62s/it]Best trial: 26. Best value: 130.92:  85%|████████▌ | 34/40 [13:00<02:03, 20.62s/it]Best trial: 26. Best value: 130.92:  88%|████████▊ | 35/40 [13:00<02:04, 24.80s/it]                                                                                   [I 2025-10-06 10:59:51,235] Trial 35 pruned. Trial was pruned at epoch 5.
Best trial: 26. Best value: 130.92:  88%|████████▊ | 35/40 [13:11<02:04, 24.80s/it]Best trial: 26. Best value: 130.92:  88%|████████▊ | 35/40 [13:11<02:04, 24.80s/it]Best trial: 26. Best value: 130.92:  90%|█████████ | 36/40 [13:11<01:22, 20.67s/it]2025-10-06 10:59:57.756298: I external/local_xla/xla/stream_executor/cuda/cuda_asm_compiler.cc:397] ptxas warning : Registers are spilled to local memory in function 'gemm_fusion_dot_6', 8 bytes spill stores, 8 bytes spill loads

2025-10-06 11:00:07.104623: I external/local_xla/xla/stream_executor/cuda/cuda_asm_compiler.cc:397] ptxas warning : Registers are spilled to local memory in function 'gemm_fusion_dot_6', 8 bytes spill stores, 8 bytes spill loads

                                                                                   [I 2025-10-06 11:00:07,484] Trial 36 finished with value: 132.02032129325772 and parameters: {'seq_len': 24, 'd_model': 32, 'heads': 8, 'ff_dim': 128, 'att_dropout': 0.12132967764330808, 'dropout': 0.3744359062195634, 'lr': 0.0016603863049636386, 'batch': 128, 'epochs': 88}. Best is trial 26 with value: 130.92029272375999.
Best trial: 26. Best value: 130.92:  90%|█████████ | 36/40 [13:27<01:22, 20.67s/it]Best trial: 26. Best value: 130.92:  90%|█████████ | 36/40 [13:27<01:22, 20.67s/it]Best trial: 26. Best value: 130.92:  92%|█████████▎| 37/40 [13:27<00:58, 19.34s/it]2025-10-06 11:00:10.865530: I external/local_xla/xla/stream_executor/cuda/cuda_asm_compiler.cc:397] ptxas warning : Registers are spilled to local memory in function 'gemm_fusion_dot_6', 52 bytes spill stores, 52 bytes spill loads

2025-10-06 11:00:12.837947: I external/local_xla/xla/stream_executor/cuda/cuda_asm_compiler.cc:397] ptxas warning : Registers are spilled to local memory in function 'gemm_fusion_dot_6', 48 bytes spill stores, 48 bytes spill loads

2025-10-06 11:00:14.570215: I external/local_xla/xla/stream_executor/cuda/cuda_asm_compiler.cc:397] ptxas warning : Registers are spilled to local memory in function 'gemm_fusion_dot_6', 48 bytes spill stores, 48 bytes spill loads

2025-10-06 11:00:30.138549: I external/local_xla/xla/stream_executor/cuda/cuda_asm_compiler.cc:397] ptxas warning : Registers are spilled to local memory in function 'gemm_fusion_dot_6', 48 bytes spill stores, 48 bytes spill loads

                                                                                   [I 2025-10-06 11:00:30,896] Trial 37 finished with value: 132.89110174076743 and parameters: {'seq_len': 6, 'd_model': 64, 'heads': 2, 'ff_dim': 96, 'att_dropout': 0.16830256254215545, 'dropout': 0.3408973433865041, 'lr': 0.0037721142684324313, 'batch': 64, 'epochs': 65}. Best is trial 26 with value: 130.92029272375999.
Best trial: 26. Best value: 130.92:  92%|█████████▎| 37/40 [13:51<00:58, 19.34s/it]Best trial: 26. Best value: 130.92:  92%|█████████▎| 37/40 [13:51<00:58, 19.34s/it]Best trial: 26. Best value: 130.92:  95%|█████████▌| 38/40 [13:51<00:41, 20.56s/it]2025-10-06 11:00:34.211417: I external/local_xla/xla/stream_executor/cuda/cuda_asm_compiler.cc:397] ptxas warning : Registers are spilled to local memory in function 'gemm_fusion_dot_31', 52 bytes spill stores, 52 bytes spill loads

2025-10-06 11:00:34.244231: I external/local_xla/xla/stream_executor/cuda/cuda_asm_compiler.cc:397] ptxas warning : Registers are spilled to local memory in function 'gemm_fusion_dot_31', 56 bytes spill stores, 56 bytes spill loads

2025-10-06 11:00:34.982364: I external/local_xla/xla/stream_executor/cuda/cuda_asm_compiler.cc:397] ptxas warning : Registers are spilled to local memory in function 'gemm_fusion_dot_6', 4 bytes spill stores, 4 bytes spill loads

2025-10-06 11:00:36.989932: I external/local_xla/xla/stream_executor/cuda/cuda_asm_compiler.cc:397] ptxas warning : Registers are spilled to local memory in function 'gemm_fusion_dot_31', 56 bytes spill stores, 56 bytes spill loads

2025-10-06 11:00:37.018976: I external/local_xla/xla/stream_executor/cuda/cuda_asm_compiler.cc:397] ptxas warning : Registers are spilled to local memory in function 'gemm_fusion_dot_31', 56 bytes spill stores, 56 bytes spill loads

2025-10-06 11:00:37.071396: I external/local_xla/xla/stream_executor/cuda/cuda_asm_compiler.cc:397] ptxas warning : Registers are spilled to local memory in function 'gemm_fusion_dot_6', 56 bytes spill stores, 56 bytes spill loads

2025-10-06 11:00:37.293706: I external/local_xla/xla/stream_executor/cuda/cuda_asm_compiler.cc:397] ptxas warning : Registers are spilled to local memory in function 'gemm_fusion_dot_6', 64 bytes spill stores, 64 bytes spill loads

2025-10-06 11:00:39.403643: I external/local_xla/xla/stream_executor/cuda/cuda_asm_compiler.cc:397] ptxas warning : Registers are spilled to local memory in function 'gemm_fusion_dot_6', 64 bytes spill stores, 64 bytes spill loads

2025-10-06 11:00:39.448172: I external/local_xla/xla/stream_executor/cuda/cuda_asm_compiler.cc:397] ptxas warning : Registers are spilled to local memory in function 'gemm_fusion_dot_6', 56 bytes spill stores, 56 bytes spill loads

                                                                                   [I 2025-10-06 11:00:42,367] Trial 38 pruned. Trial was pruned at epoch 5.
Best trial: 26. Best value: 130.92:  95%|█████████▌| 38/40 [14:02<00:41, 20.56s/it]Best trial: 26. Best value: 130.92:  95%|█████████▌| 38/40 [14:02<00:41, 20.56s/it]Best trial: 26. Best value: 130.92:  98%|█████████▊| 39/40 [14:02<00:17, 17.84s/it]2025-10-06 11:00:45.889366: I external/local_xla/xla/stream_executor/cuda/cuda_asm_compiler.cc:397] ptxas warning : Registers are spilled to local memory in function 'gemm_fusion_dot_6', 52 bytes spill stores, 52 bytes spill loads

2025-10-06 11:00:48.183522: I external/local_xla/xla/stream_executor/cuda/cuda_asm_compiler.cc:397] ptxas warning : Registers are spilled to local memory in function 'gemm_fusion_dot_6', 48 bytes spill stores, 48 bytes spill loads

2025-10-06 11:00:50.080013: I external/local_xla/xla/stream_executor/cuda/cuda_asm_compiler.cc:397] ptxas warning : Registers are spilled to local memory in function 'gemm_fusion_dot_6', 48 bytes spill stores, 48 bytes spill loads

                                                                                   [I 2025-10-06 11:00:53,104] Trial 39 pruned. Trial was pruned at epoch 5.
Best trial: 26. Best value: 130.92:  98%|█████████▊| 39/40 [14:13<00:17, 17.84s/it]Best trial: 26. Best value: 130.92:  98%|█████████▊| 39/40 [14:13<00:17, 17.84s/it]Best trial: 26. Best value: 130.92: 100%|██████████| 40/40 [14:13<00:00, 15.71s/it]Best trial: 26. Best value: 130.92: 100%|██████████| 40/40 [14:13<00:00, 21.34s/it]
/home/e.ladino/miniconda3/envs/e_ladino/lib/python3.12/site-packages/keras/src/saving/saving_lib.py:797: UserWarning: Skipping variable loading for optimizer 'adam', because it has 2 variables whereas the saved optimizer has 42 variables. 
  saveable.load_own_variables(weights_store.get(inner_path))
Best Transformer params: {'seq_len': 24, 'd_model': 32, 'heads': 8, 'ff_dim': 96, 'att_dropout': 0.10491772630248755, 'dropout': 0.3963910655147282, 'lr': 0.004827891115632173, 'batch': 64, 'epochs': 86}
Transformer test → RMSE: 138.0246 | MAE: 71.7022 | R2: 0.7131 | Skill: 0.297
Saved params → ../models/best_hpo_params_all.json

=== MLP ===
RMSE=135.5935 | MAE=66.8857 | R2=0.7228 | Skill=0.309

=== LSTM ===
RMSE=136.8780 | MAE=71.1631 | R2=0.7177 | Skill=0.303

=== BiLSTM ===
RMSE=136.8247 | MAE=70.5807 | R2=0.7180 | Skill=0.303

=== CNN-LSTM ===
RMSE=138.7057 | MAE=70.8367 | R2=0.7102 | Skill=0.294

=== Transformer ===
RMSE=138.0246 | MAE=71.7022 | R2=0.7131 | Skill=0.297

=== Test Summary ===
         model      RMSE      MAE      R2   Skill
0          MLP  135.5935  66.8857  0.7228  0.3092
2       BiLSTM  136.8247  70.5807  0.7180  0.3034
1         LSTM  136.8780  71.1631  0.7177  0.3031
4  Transformer  138.0246  71.7022  0.7131  0.2975
3     CNN-LSTM  138.7057  70.8367  0.7102  0.2938
