                                      [I 2025-10-06 10:47:01,561] Trial 0 finished with value: 134.41970913197588 and parameters: {'seq_len': 12, 'd_model': 128, 'heads': 4, 'ff_dim': 64, 'att_dropout': 0.055021352956030146, 'dropout': 0.1216968971838151, 'lr': 0.0005603803105930283, 'batch': 256, 'epochs': 51}. Best is trial 0 with value: 134.41970913197588.
  0%|          | 0/40 [00:21<?, ?it/s]Best trial: 0. Best value: 134.42:   0%|          | 0/40 [00:21<?, ?it/s]Best trial: 0. Best value: 134.42:   2%|▎         | 1/40 [00:21<14:17, 21.99s/it]2025-10-06 10:47:04.365246: I external/local_xla/xla/stream_executor/cuda/cuda_asm_compiler.cc:397] ptxas warning : Registers are spilled to local memory in function 'gemm_fusion_dot_31', 56 bytes spill stores, 56 bytes spill loads

2025-10-06 10:47:04.379438: I external/local_xla/xla/stream_executor/cuda/cuda_asm_compiler.cc:397] ptxas warning : Registers are spilled to local memory in function 'gemm_fusion_dot_6', 56 bytes spill stores, 56 bytes spill loads

2025-10-06 10:47:04.399939: I external/local_xla/xla/stream_executor/cuda/cuda_asm_compiler.cc:397] ptxas warning : Registers are spilled to local memory in function 'gemm_fusion_dot_31', 52 bytes spill stores, 52 bytes spill loads

2025-10-06 10:47:04.527905: I external/local_xla/xla/stream_executor/cuda/cuda_asm_compiler.cc:397] ptxas warning : Registers are spilled to local memory in function 'gemm_fusion_dot_19', 12 bytes spill stores, 12 bytes spill loads

2025-10-06 10:47:04.723477: I external/local_xla/xla/stream_executor/cuda/cuda_asm_compiler.cc:397] ptxas warning : Registers are spilled to local memory in function 'gemm_fusion_dot_6', 52 bytes spill stores, 52 bytes spill loads

2025-10-06 10:47:04.779683: I external/local_xla/xla/stream_executor/cuda/cuda_asm_compiler.cc:397] ptxas warning : Registers are spilled to local memory in function 'gemm_fusion_dot_19', 4 bytes spill stores, 4 bytes spill loads

2025-10-06 10:47:04.789949: I external/local_xla/xla/stream_executor/cuda/cuda_asm_compiler.cc:397] ptxas warning : Registers are spilled to local memory in function 'gemm_fusion_dot_11', 52 bytes spill stores, 52 bytes spill loads

2025-10-06 10:47:04.812156: I external/local_xla/xla/stream_executor/cuda/cuda_asm_compiler.cc:397] ptxas warning : Registers are spilled to local memory in function 'gemm_fusion_dot_11', 44 bytes spill stores, 44 bytes spill loads

2025-10-06 10:47:04.813739: I external/local_xla/xla/stream_executor/cuda/cuda_asm_compiler.cc:397] ptxas warning : Registers are spilled to local memory in function 'gemm_fusion_dot_2435', 12 bytes spill stores, 12 bytes spill loads

2025-10-06 10:47:06.972273: I external/local_xla/xla/stream_executor/cuda/cuda_asm_compiler.cc:397] ptxas warning : Registers are spilled to local memory in function 'gemm_fusion_dot_31', 56 bytes spill stores, 56 bytes spill loads

2025-10-06 10:47:06.972724: I external/local_xla/xla/stream_executor/cuda/cuda_asm_compiler.cc:397] ptxas warning : Registers are spilled to local memory in function 'gemm_fusion_dot_31', 56 bytes spill stores, 56 bytes spill loads

2025-10-06 10:47:07.071488: I external/local_xla/xla/stream_executor/cuda/cuda_asm_compiler.cc:397] ptxas warning : Registers are spilled to local memory in function 'gemm_fusion_dot_6', 56 bytes spill stores, 56 bytes spill loads

2025-10-06 10:47:07.084629: I external/local_xla/xla/stream_executor/cuda/cuda_asm_compiler.cc:397] ptxas warning : Registers are spilled to local memory in function 'gemm_fusion_dot_6', 56 bytes spill stores, 56 bytes spill loads

2025-10-06 10:47:08.506112: I external/local_xla/xla/stream_executor/cuda/cuda_asm_compiler.cc:397] ptxas warning : Registers are spilled to local memory in function 'input_add_multiply_reduce_fusion', 40 bytes spill stores, 24 bytes spill loads

2025-10-06 10:47:09.491301: I external/local_xla/xla/stream_executor/cuda/cuda_asm_compiler.cc:397] ptxas warning : Registers are spilled to local memory in function 'gemm_fusion_dot_10', 56 bytes spill stores, 56 bytes spill loads

2025-10-06 10:47:09.529223: I external/local_xla/xla/stream_executor/cuda/cuda_asm_compiler.cc:397] ptxas warning : Registers are spilled to local memory in function 'gemm_fusion_dot_6', 56 bytes spill stores, 56 bytes spill loads

2025-10-06 10:47:09.557145: I external/local_xla/xla/stream_executor/cuda/cuda_asm_compiler.cc:397] ptxas warning : Registers are spilled to local memory in function 'gemm_fusion_dot_10', 80 bytes spill stores, 80 bytes spill loads

2025-10-06 10:47:09.572492: I external/local_xla/xla/stream_executor/cuda/cuda_asm_compiler.cc:397] ptxas warning : Registers are spilled to local memory in function 'gemm_fusion_dot_6', 80 bytes spill stores, 80 bytes spill loads

2025-10-06 10:47:25.264814: I external/local_xla/xla/stream_executor/cuda/cuda_asm_compiler.cc:397] ptxas warning : Registers are spilled to local memory in function 'gemm_fusion_dot_10', 52 bytes spill stores, 52 bytes spill loads

2025-10-06 10:47:25.278139: I external/local_xla/xla/stream_executor/cuda/cuda_asm_compiler.cc:397] ptxas warning : Registers are spilled to local memory in function 'gemm_fusion_dot_10', 56 bytes spill stores, 56 bytes spill loads

2025-10-06 10:47:25.305250: I external/local_xla/xla/stream_executor/cuda/cuda_asm_compiler.cc:397] ptxas warning : Registers are spilled to local memory in function 'gemm_fusion_dot_6', 56 bytes spill stores, 56 bytes spill loads

2025-10-06 10:47:25.340639: I external/local_xla/xla/stream_executor/cuda/cuda_asm_compiler.cc:397] ptxas warning : Registers are spilled to local memory in function 'gemm_fusion_dot_6', 52 bytes spill stores, 52 bytes spill loads

2025-10-06 10:47:26.333001: I external/local_xla/xla/stream_executor/cuda/cuda_asm_compiler.cc:397] ptxas warning : Registers are spilled to local memory in function 'gemm_fusion_dot_10', 80 bytes spill stores, 80 bytes spill loads

2025-10-06 10:47:26.367983: I external/local_xla/xla/stream_executor/cuda/cuda_asm_compiler.cc:397] ptxas warning : Registers are spilled to local memory in function 'gemm_fusion_dot_6', 80 bytes spill stores, 80 bytes spill loads

2025-10-06 10:47:26.384544: I external/local_xla/xla/stream_executor/cuda/cuda_asm_compiler.cc:397] ptxas warning : Registers are spilled to local memory in function 'gemm_fusion_dot_6', 56 bytes spill stores, 56 bytes spill loads

2025-10-06 10:47:26.418320: I external/local_xla/xla/stream_executor/cuda/cuda_asm_compiler.cc:397] ptxas warning : Registers are spilled to local memory in function 'gemm_fusion_dot_10', 56 bytes spill stores, 56 bytes spill loads

                                                                                 [I 2025-10-06 10:47:26,976] Trial 1 finished with value: 133.44145925039564 and parameters: {'seq_len': 24, 'd_model': 96, 'heads': 2, 'ff_dim': 96, 'att_dropout': 0.029301634201915158, 'dropout': 0.2736932106048628, 'lr': 0.0003795552402641347, 'batch': 128, 'epochs': 113}. Best is trial 1 with value: 133.44145925039564.
Best trial: 0. Best value: 134.42:   2%|▎         | 1/40 [00:47<14:17, 21.99s/it]Best trial: 1. Best value: 133.441:   2%|▎         | 1/40 [00:47<14:17, 21.99s/it]Best trial: 1. Best value: 133.441:   5%|▌         | 2/40 [00:47<15:12, 24.00s/it]2025-10-06 10:47:30.272533: I external/local_xla/xla/stream_executor/cuda/cuda_asm_compiler.cc:397] ptxas warning : Registers are spilled to local memory in function 'gemm_fusion_dot_11', 52 bytes spill stores, 52 bytes spill loads

2025-10-06 10:47:30.281809: I external/local_xla/xla/stream_executor/cuda/cuda_asm_compiler.cc:397] ptxas warning : Registers are spilled to local memory in function 'gemm_fusion_dot_6', 4 bytes spill stores, 4 bytes spill loads

2025-10-06 10:47:30.390647: I external/local_xla/xla/stream_executor/cuda/cuda_asm_compiler.cc:397] ptxas warning : Registers are spilled to local memory in function 'gemm_fusion_dot_11', 44 bytes spill stores, 44 bytes spill loads

2025-10-06 10:47:32.720058: I external/local_xla/xla/stream_executor/cuda/cuda_asm_compiler.cc:397] ptxas warning : Registers are spilled to local memory in function 'gemm_fusion_dot_31', 56 bytes spill stores, 56 bytes spill loads

2025-10-06 10:47:32.923566: I external/local_xla/xla/stream_executor/cuda/cuda_asm_compiler.cc:397] ptxas warning : Registers are spilled to local memory in function 'gemm_fusion_dot_31', 80 bytes spill stores, 80 bytes spill loads

2025-10-06 10:47:32.970296: I external/local_xla/xla/stream_executor/cuda/cuda_asm_compiler.cc:397] ptxas warning : Registers are spilled to local memory in function 'gemm_fusion_dot_6', 64 bytes spill stores, 64 bytes spill loads

2025-10-06 10:47:33.029692: I external/local_xla/xla/stream_executor/cuda/cuda_asm_compiler.cc:397] ptxas warning : Registers are spilled to local memory in function 'gemm_fusion_dot_6', 56 bytes spill stores, 56 bytes spill loads

2025-10-06 10:47:35.037179: I external/local_xla/xla/stream_executor/cuda/cuda_asm_compiler.cc:397] ptxas warning : Registers are spilled to local memory in function 'gemm_fusion_dot_10', 56 bytes spill stores, 56 bytes spill loads

2025-10-06 10:47:35.126486: I external/local_xla/xla/stream_executor/cuda/cuda_asm_compiler.cc:397] ptxas warning : Registers are spilled to local memory in function 'gemm_fusion_dot_10', 80 bytes spill stores, 80 bytes spill loads

2025-10-06 10:47:35.137600: I external/local_xla/xla/stream_executor/cuda/cuda_asm_compiler.cc:397] ptxas warning : Registers are spilled to local memory in function 'gemm_fusion_dot_6', 64 bytes spill stores, 64 bytes spill loads

2025-10-06 10:47:35.144638: I external/local_xla/xla/stream_executor/cuda/cuda_asm_compiler.cc:397] ptxas warning : Registers are spilled to local memory in function 'gemm_fusion_dot_6', 56 bytes spill stores, 56 bytes spill loads

2025-10-06 10:47:57.585859: I external/local_xla/xla/stream_executor/cuda/cuda_asm_compiler.cc:397] ptxas warning : Registers are spilled to local memory in function 'gemm_fusion_dot_10', 56 bytes spill stores, 56 bytes spill loads

2025-10-06 10:47:57.604957: I external/local_xla/xla/stream_executor/cuda/cuda_asm_compiler.cc:397] ptxas warning : Registers are spilled to local memory in function 'gemm_fusion_dot_10', 52 bytes spill stores, 52 bytes spill loads

2025-10-06 10:47:57.699043: I external/local_xla/xla/stream_executor/cuda/cuda_asm_compiler.cc:397] ptxas warning : Registers are spilled to local memory in function 'gemm_fusion_dot_6', 64 bytes spill stores, 64 bytes spill loads

                                                                                  [I 2025-10-06 10:47:58,528] Trial 2 finished with value: 134.13907341123615 and parameters: {'seq_len': 12, 'd_model': 96, 'heads': 2, 'ff_dim': 64, 'att_dropout': 0.0975990992289793, 'dropout': 0.15547091587579281, 'lr': 0.0001744488327445185, 'batch': 64, 'epochs': 83}. Best is trial 1 with value: 133.44145925039564.
Best trial: 1. Best value: 133.441:   5%|▌         | 2/40 [01:18<15:12, 24.00s/it]Best trial: 1. Best value: 133.441:   5%|▌         | 2/40 [01:18<15:12, 24.00s/it]Best trial: 1. Best value: 133.441:   8%|▊         | 3/40 [01:18<16:55, 27.45s/it]2025-10-06 10:48:01.468710: I external/local_xla/xla/stream_executor/cuda/cuda_asm_compiler.cc:397] ptxas warning : Registers are spilled to local memory in function 'gemm_fusion_dot_19', 8 bytes spill stores, 8 bytes spill loads

2025-10-06 10:48:01.686054: I external/local_xla/xla/stream_executor/cuda/cuda_asm_compiler.cc:397] ptxas warning : Registers are spilled to local memory in function 'gemm_fusion_dot_2431', 24 bytes spill stores, 24 bytes spill loads

2025-10-06 10:48:01.712269: I external/local_xla/xla/stream_executor/cuda/cuda_asm_compiler.cc:397] ptxas warning : Registers are spilled to local memory in function 'gemm_fusion_dot_2431', 8 bytes spill stores, 8 bytes spill loads

2025-10-06 10:48:01.749912: I external/local_xla/xla/stream_executor/cuda/cuda_asm_compiler.cc:397] ptxas warning : Registers are spilled to local memory in function 'gemm_fusion_dot_6', 760 bytes spill stores, 836 bytes spill loads

2025-10-06 10:48:01.788779: I external/local_xla/xla/stream_executor/cuda/cuda_asm_compiler.cc:397] ptxas warning : Registers are spilled to local memory in function 'gemm_fusion_dot_2431', 8 bytes spill stores, 8 bytes spill loads

2025-10-06 10:48:01.837035: I external/local_xla/xla/stream_executor/cuda/cuda_asm_compiler.cc:397] ptxas warning : Registers are spilled to local memory in function 'gemm_fusion_dot_11', 84 bytes spill stores, 84 bytes spill loads

2025-10-06 10:48:03.871531: I external/local_xla/xla/stream_executor/cuda/cuda_asm_compiler.cc:397] ptxas warning : Registers are spilled to local memory in function 'gemm_fusion_dot_31', 40 bytes spill stores, 40 bytes spill loads

2025-10-06 10:48:04.197106: I external/local_xla/xla/stream_executor/cuda/cuda_asm_compiler.cc:397] ptxas warning : Registers are spilled to local memory in function 'gemm_fusion_dot_6', 760 bytes spill stores, 836 bytes spill loads

2025-10-06 10:48:06.365661: I external/local_xla/xla/stream_executor/cuda/cuda_asm_compiler.cc:397] ptxas warning : Registers are spilled to local memory in function 'gemm_fusion_dot_6', 12 bytes spill stores, 12 bytes spill loads

2025-10-06 10:48:06.392828: I external/local_xla/xla/stream_executor/cuda/cuda_asm_compiler.cc:397] ptxas warning : Registers are spilled to local memory in function 'gemm_fusion_dot_10', 20 bytes spill stores, 20 bytes spill loads

2025-10-06 10:48:06.479910: I external/local_xla/xla/stream_executor/cuda/cuda_asm_compiler.cc:397] ptxas warning : Registers are spilled to local memory in function 'gemm_fusion_dot_10', 8 bytes spill stores, 8 bytes spill loads

2025-10-06 10:48:06.728763: I external/local_xla/xla/stream_executor/cuda/cuda_asm_compiler.cc:397] ptxas warning : Registers are spilled to local memory in function 'gemm_fusion_dot_6', 816 bytes spill stores, 956 bytes spill loads

2025-10-06 10:48:59.394122: I external/local_xla/xla/stream_executor/cuda/cuda_asm_compiler.cc:397] ptxas warning : Registers are spilled to local memory in function 'gemm_fusion_dot_6', 760 bytes spill stores, 836 bytes spill loads

2025-10-06 10:49:00.204478: I external/local_xla/xla/stream_executor/cuda/cuda_asm_compiler.cc:397] ptxas warning : Registers are spilled to local memory in function 'gemm_fusion_dot_6', 12 bytes spill stores, 12 bytes spill loads

2025-10-06 10:49:00.236595: I external/local_xla/xla/stream_executor/cuda/cuda_asm_compiler.cc:397] ptxas warning : Registers are spilled to local memory in function 'gemm_fusion_dot_10', 8 bytes spill stores, 8 bytes spill loads

2025-10-06 10:49:00.274911: I external/local_xla/xla/stream_executor/cuda/cuda_asm_compiler.cc:397] ptxas warning : Registers are spilled to local memory in function 'gemm_fusion_dot_10', 20 bytes spill stores, 20 bytes spill loads

2025-10-06 10:49:00.540203: I external/local_xla/xla/stream_executor/cuda/cuda_asm_compiler.cc:397] ptxas warning : Registers are spilled to local memory in function 'gemm_fusion_dot_6', 816 bytes spill stores, 956 bytes spill loads

                                                                                  [I 2025-10-06 10:49:00,964] Trial 3 finished with value: 139.1344055670631 and parameters: {'seq_len': 24, 'd_model': 128, 'heads': 8, 'ff_dim': 192, 'att_dropout': 0.18698943804826737, 'dropout': 0.13235920994105968, 'lr': 6.700183621677408e-05, 'batch': 256, 'epochs': 91}. Best is trial 1 with value: 133.44145925039564.
Best trial: 1. Best value: 133.441:   8%|▊         | 3/40 [02:21<16:55, 27.45s/it]Best trial: 1. Best value: 133.441:   8%|▊         | 3/40 [02:21<16:55, 27.45s/it]Best trial: 1. Best value: 133.441:  10%|█         | 4/40 [02:21<24:45, 41.26s/it]2025-10-06 10:49:03.638403: I external/local_xla/xla/stream_executor/cuda/cuda_asm_compiler.cc:397] ptxas warning : Registers are spilled to local memory in function 'gemm_fusion_dot_6', 20 bytes spill stores, 20 bytes spill loads

2025-10-06 10:49:03.805240: I external/local_xla/xla/stream_executor/cuda/cuda_asm_compiler.cc:397] ptxas warning : Registers are spilled to local memory in function 'gemm_fusion_dot_11', 40 bytes spill stores, 40 bytes spill loads

2025-10-06 10:49:03.812993: I external/local_xla/xla/stream_executor/cuda/cuda_asm_compiler.cc:397] ptxas warning : Registers are spilled to local memory in function 'gemm_fusion_dot_11', 132 bytes spill stores, 132 bytes spill loads

2025-10-06 10:49:03.977300: I external/local_xla/xla/stream_executor/cuda/cuda_asm_compiler.cc:397] ptxas warning : Registers are spilled to local memory in function 'gemm_fusion_dot_11', 20 bytes spill stores, 20 bytes spill loads

2025-10-06 10:49:05.940632: I external/local_xla/xla/stream_executor/cuda/cuda_asm_compiler.cc:397] ptxas warning : Registers are spilled to local memory in function 'gemm_fusion_dot_31', 80 bytes spill stores, 80 bytes spill loads

2025-10-06 10:49:05.943995: I external/local_xla/xla/stream_executor/cuda/cuda_asm_compiler.cc:397] ptxas warning : Registers are spilled to local memory in function 'gemm_fusion_dot_31', 56 bytes spill stores, 56 bytes spill loads

2025-10-06 10:49:08.315917: I external/local_xla/xla/stream_executor/cuda/cuda_asm_compiler.cc:397] ptxas warning : Registers are spilled to local memory in function 'gemm_fusion_dot_10', 56 bytes spill stores, 56 bytes spill loads

2025-10-06 10:49:08.408234: I external/local_xla/xla/stream_executor/cuda/cuda_asm_compiler.cc:397] ptxas warning : Registers are spilled to local memory in function 'gemm_fusion_dot_10', 80 bytes spill stores, 80 bytes spill loads

2025-10-06 10:49:31.478420: I external/local_xla/xla/stream_executor/cuda/cuda_asm_compiler.cc:397] ptxas warning : Registers are spilled to local memory in function 'gemm_fusion_dot_10', 56 bytes spill stores, 56 bytes spill loads

2025-10-06 10:49:31.479249: I external/local_xla/xla/stream_executor/cuda/cuda_asm_compiler.cc:397] ptxas warning : Registers are spilled to local memory in function 'gemm_fusion_dot_10', 56 bytes spill stores, 56 bytes spill loads

2025-10-06 10:49:32.418132: I external/local_xla/xla/stream_executor/cuda/cuda_asm_compiler.cc:397] ptxas warning : Registers are spilled to local memory in function 'gemm_fusion_dot_10', 56 bytes spill stores, 56 bytes spill loads

2025-10-06 10:49:32.431324: I external/local_xla/xla/stream_executor/cuda/cuda_asm_compiler.cc:397] ptxas warning : Registers are spilled to local memory in function 'gemm_fusion_dot_10', 80 bytes spill stores, 80 bytes spill loads

                                                                                  [I 2025-10-06 10:49:32,938] Trial 4 finished with value: 133.31452178495036 and parameters: {'seq_len': 6, 'd_model': 96, 'heads': 2, 'ff_dim': 128, 'att_dropout': 0.15257120734941082, 'dropout': 0.3630265895704372, 'lr': 0.00015759936475969445, 'batch': 128, 'epochs': 46}. Best is trial 4 with value: 133.31452178495036.
