Best trial: 11. Best value: 131.055:  40%|████      | 14/35 [13:57<13:23, 38.27s/it]Best trial: 11. Best value: 131.055:  40%|████      | 14/35 [13:57<13:23, 38.27s/it]Best trial: 11. Best value: 131.055:  43%|████▎     | 15/35 [13:57<12:23, 37.16s/it]                                                                                    [I 2025-10-06 10:39:50,914] Trial 15 finished with value: 131.61876023908977 and parameters: {'seq_len': 6, 'filters': 48, 'kernel_size': 2, 'pool': 1, 'lstm_units': 128, 'dropout': 0.0859486412411985, 'lr': 0.004548007664220133, 'batch': 64, 'epochs': 50}. Best is trial 11 with value: 131.05451215524783.
Best trial: 11. Best value: 131.055:  43%|████▎     | 15/35 [14:19<12:23, 37.16s/it]Best trial: 11. Best value: 131.055:  43%|████▎     | 15/35 [14:19<12:23, 37.16s/it]Best trial: 11. Best value: 131.055:  46%|████▌     | 16/35 [14:19<10:19, 32.61s/it]                                                                                    [I 2025-10-06 10:39:55,439] Trial 16 pruned. Trial was pruned at epoch 5.
Best trial: 11. Best value: 131.055:  46%|████▌     | 16/35 [14:23<10:19, 32.61s/it]Best trial: 11. Best value: 131.055:  46%|████▌     | 16/35 [14:23<10:19, 32.61s/it]Best trial: 11. Best value: 131.055:  49%|████▊     | 17/35 [14:23<07:14, 24.16s/it]                                                                                    [I 2025-10-06 10:40:30,704] Trial 17 finished with value: 131.33532196966283 and parameters: {'seq_len': 18, 'filters': 48, 'kernel_size': 2, 'pool': 1, 'lstm_units': 128, 'dropout': 0.1509376605388808, 'lr': 0.00151278754950663, 'batch': 64, 'epochs': 86}. Best is trial 11 with value: 131.05451215524783.
Best trial: 11. Best value: 131.055:  49%|████▊     | 17/35 [14:59<07:14, 24.16s/it]Best trial: 11. Best value: 131.055:  49%|████▊     | 17/35 [14:59<07:14, 24.16s/it]Best trial: 11. Best value: 131.055:  51%|█████▏    | 18/35 [14:59<07:47, 27.50s/it]                                                                                    [I 2025-10-06 10:40:41,768] Trial 18 pruned. Trial was pruned at epoch 5.
Best trial: 11. Best value: 131.055:  51%|█████▏    | 18/35 [15:10<07:47, 27.50s/it]Best trial: 11. Best value: 131.055:  51%|█████▏    | 18/35 [15:10<07:47, 27.50s/it]Best trial: 11. Best value: 131.055:  54%|█████▍    | 19/35 [15:10<06:01, 22.56s/it]                                                                                    [I 2025-10-06 10:40:46,477] Trial 19 pruned. Trial was pruned at epoch 5.
Best trial: 11. Best value: 131.055:  54%|█████▍    | 19/35 [15:14<06:01, 22.56s/it]Best trial: 11. Best value: 131.055:  54%|█████▍    | 19/35 [15:14<06:01, 22.56s/it]Best trial: 11. Best value: 131.055:  57%|█████▋    | 20/35 [15:14<04:18, 17.20s/it]                                                                                    [I 2025-10-06 10:41:19,439] Trial 20 finished with value: 131.84207231096605 and parameters: {'seq_len': 18, 'filters': 32, 'kernel_size': 3, 'pool': 1, 'lstm_units': 96, 'dropout': 0.13904201638798758, 'lr': 0.003824733457735936, 'batch': 64, 'epochs': 56}. Best is trial 11 with value: 131.05451215524783.
Best trial: 11. Best value: 131.055:  57%|█████▋    | 20/35 [15:47<04:18, 17.20s/it]Best trial: 11. Best value: 131.055:  57%|█████▋    | 20/35 [15:47<04:18, 17.20s/it]Best trial: 11. Best value: 131.055:  60%|██████    | 21/35 [15:47<05:07, 21.93s/it]                                                                                    [I 2025-10-06 10:41:59,826] Trial 21 finished with value: 131.78651504184714 and parameters: {'seq_len': 18, 'filters': 48, 'kernel_size': 2, 'pool': 1, 'lstm_units': 128, 'dropout': 0.1595199172323938, 'lr': 0.0014394508654573949, 'batch': 64, 'epochs': 85}. Best is trial 11 with value: 131.05451215524783.
Best trial: 11. Best value: 131.055:  60%|██████    | 21/35 [16:28<05:07, 21.93s/it]Best trial: 11. Best value: 131.055:  60%|██████    | 21/35 [16:28<05:07, 21.93s/it]Best trial: 11. Best value: 131.055:  63%|██████▎   | 22/35 [16:28<05:57, 27.47s/it]                                                                                    [I 2025-10-06 10:42:38,482] Trial 22 finished with value: 131.64916978944456 and parameters: {'seq_len': 18, 'filters': 48, 'kernel_size': 2, 'pool': 1, 'lstm_units': 128, 'dropout': 0.09356120900182516, 'lr': 0.001621686922126068, 'batch': 64, 'epochs': 81}. Best is trial 11 with value: 131.05451215524783.
Best trial: 11. Best value: 131.055:  63%|██████▎   | 22/35 [17:06<05:57, 27.47s/it]Best trial: 11. Best value: 131.055:  63%|██████▎   | 22/35 [17:06<05:57, 27.47s/it]Best trial: 11. Best value: 131.055:  66%|██████▌   | 23/35 [17:06<06:09, 30.83s/it]                                                                                    [I 2025-10-06 10:42:50,401] Trial 23 pruned. Trial was pruned at epoch 5.
Best trial: 11. Best value: 131.055:  66%|██████▌   | 23/35 [17:18<06:09, 30.83s/it]Best trial: 11. Best value: 131.055:  66%|██████▌   | 23/35 [17:18<06:09, 30.83s/it]Best trial: 11. Best value: 131.055:  69%|██████▊   | 24/35 [17:18<04:36, 25.15s/it]                                                                                    [I 2025-10-06 10:43:25,131] Trial 24 finished with value: 131.57155550783003 and parameters: {'seq_len': 18, 'filters': 48, 'kernel_size': 2, 'pool': 1, 'lstm_units': 128, 'dropout': 0.1556423175104839, 'lr': 0.0016050902245668206, 'batch': 64, 'epochs': 82}. Best is trial 11 with value: 131.05451215524783.
Best trial: 11. Best value: 131.055:  69%|██████▊   | 24/35 [17:53<04:36, 25.15s/it]Best trial: 11. Best value: 131.055:  69%|██████▊   | 24/35 [17:53<04:36, 25.15s/it]Best trial: 11. Best value: 131.055:  71%|███████▏  | 25/35 [17:53<04:40, 28.03s/it]                                                                                    [I 2025-10-06 10:43:42,104] Trial 25 pruned. Trial was pruned at epoch 9.
Best trial: 11. Best value: 131.055:  71%|███████▏  | 25/35 [18:10<04:40, 28.03s/it]Best trial: 11. Best value: 131.055:  71%|███████▏  | 25/35 [18:10<04:40, 28.03s/it]Best trial: 11. Best value: 131.055:  74%|███████▍  | 26/35 [18:10<03:42, 24.71s/it]                                                                                    [I 2025-10-06 10:44:08,664] Trial 26 finished with value: 131.7727091434338 and parameters: {'seq_len': 18, 'filters': 48, 'kernel_size': 2, 'pool': 2, 'lstm_units': 128, 'dropout': 0.08111610997884844, 'lr': 0.0031235792356209807, 'batch': 64, 'epochs': 58}. Best is trial 11 with value: 131.05451215524783.
Best trial: 11. Best value: 131.055:  74%|███████▍  | 26/35 [18:37<03:42, 24.71s/it]Best trial: 11. Best value: 131.055:  74%|███████▍  | 26/35 [18:37<03:42, 24.71s/it]Best trial: 11. Best value: 131.055:  77%|███████▋  | 27/35 [18:37<03:22, 25.27s/it]                                                                                    [I 2025-10-06 10:44:42,979] Trial 27 finished with value: 131.87430390811548 and parameters: {'seq_len': 24, 'filters': 64, 'kernel_size': 2, 'pool': 1, 'lstm_units': 96, 'dropout': 0.1801835944852071, 'lr': 0.001961012341385061, 'batch': 64, 'epochs': 72}. Best is trial 11 with value: 131.05451215524783.
Best trial: 11. Best value: 131.055:  77%|███████▋  | 27/35 [19:11<03:22, 25.27s/it]Best trial: 11. Best value: 131.055:  77%|███████▋  | 27/35 [19:11<03:22, 25.27s/it]Best trial: 11. Best value: 131.055:  80%|████████  | 28/35 [19:11<03:15, 27.98s/it]                                                                                    [I 2025-10-06 10:44:49,637] Trial 28 pruned. Trial was pruned at epoch 5.
Best trial: 11. Best value: 131.055:  80%|████████  | 28/35 [19:17<03:15, 27.98s/it]Best trial: 11. Best value: 131.055:  80%|████████  | 28/35 [19:17<03:15, 27.98s/it]Best trial: 11. Best value: 131.055:  83%|████████▎ | 29/35 [19:17<02:09, 21.58s/it]                                                                                    [I 2025-10-06 10:44:56,661] Trial 29 pruned. Trial was pruned at epoch 5.
Best trial: 11. Best value: 131.055:  83%|████████▎ | 29/35 [19:25<02:09, 21.58s/it]Best trial: 11. Best value: 131.055:  83%|████████▎ | 29/35 [19:25<02:09, 21.58s/it]Best trial: 11. Best value: 131.055:  86%|████████▌ | 30/35 [19:25<01:26, 17.22s/it]                                                                                    [I 2025-10-06 10:45:07,879] Trial 30 pruned. Trial was pruned at epoch 5.
Best trial: 11. Best value: 131.055:  86%|████████▌ | 30/35 [19:36<01:26, 17.22s/it]Best trial: 11. Best value: 131.055:  86%|████████▌ | 30/35 [19:36<01:26, 17.22s/it]Best trial: 11. Best value: 131.055:  89%|████████▊ | 31/35 [19:36<01:01, 15.42s/it]                                                                                    [I 2025-10-06 10:45:19,279] Trial 31 pruned. Trial was pruned at epoch 5.
Best trial: 11. Best value: 131.055:  89%|████████▊ | 31/35 [19:47<01:01, 15.42s/it]Best trial: 11. Best value: 131.055:  89%|████████▊ | 31/35 [19:47<01:01, 15.42s/it]Best trial: 11. Best value: 131.055:  91%|█████████▏| 32/35 [19:47<00:42, 14.21s/it]                                                                                    [I 2025-10-06 10:45:34,218] Trial 32 pruned. Trial was pruned at epoch 7.
Best trial: 11. Best value: 131.055:  91%|█████████▏| 32/35 [20:02<00:42, 14.21s/it]Best trial: 11. Best value: 131.055:  91%|█████████▏| 32/35 [20:02<00:42, 14.21s/it]Best trial: 11. Best value: 131.055:  94%|█████████▍| 33/35 [20:02<00:28, 14.43s/it]                                                                                    [I 2025-10-06 10:46:02,902] Trial 33 finished with value: 131.2674095596466 and parameters: {'seq_len': 18, 'filters': 48, 'kernel_size': 2, 'pool': 1, 'lstm_units': 128, 'dropout': 0.13491008325497722, 'lr': 0.0019954156437434153, 'batch': 64, 'epochs': 86}. Best is trial 11 with value: 131.05451215524783.
Best trial: 11. Best value: 131.055:  94%|█████████▍| 33/35 [20:31<00:28, 14.43s/it]Best trial: 11. Best value: 131.055:  94%|█████████▍| 33/35 [20:31<00:28, 14.43s/it]Best trial: 11. Best value: 131.055:  97%|█████████▋| 34/35 [20:31<00:18, 18.71s/it]                                                                                    [I 2025-10-06 10:46:38,992] Trial 34 finished with value: 131.8614921992012 and parameters: {'seq_len': 18, 'filters': 48, 'kernel_size': 2, 'pool': 1, 'lstm_units': 128, 'dropout': 0.3967825861452995, 'lr': 0.0022037731329048477, 'batch': 64, 'epochs': 86}. Best is trial 11 with value: 131.05451215524783.
Best trial: 11. Best value: 131.055:  97%|█████████▋| 34/35 [21:07<00:18, 18.71s/it]Best trial: 11. Best value: 131.055:  97%|█████████▋| 34/35 [21:07<00:18, 18.71s/it]Best trial: 11. Best value: 131.055: 100%|██████████| 35/35 [21:07<00:00, 23.92s/it]Best trial: 11. Best value: 131.055: 100%|██████████| 35/35 [21:07<00:00, 36.21s/it]
/home/e.ladino/miniconda3/envs/e_ladino/lib/python3.12/site-packages/keras/src/saving/saving_lib.py:797: UserWarning: Skipping variable loading for optimizer 'adam', because it has 2 variables whereas the saved optimizer has 16 variables. 
  saveable.load_own_variables(weights_store.get(inner_path))
Best CNN-LSTM params: {'seq_len': 18, 'filters': 32, 'kernel_size': 2, 'pool': 1, 'lstm_units': 128, 'dropout': 0.02712810710504837, 'lr': 0.0009191014050706828, 'batch': 64, 'epochs': 75}
CNN-LSTM test → RMSE: 138.7057 | MAE: 70.8367 | R2: 0.7102 | Skill: 0.294
/mnt/SOLARLAB/E_Ladino/Repo/irradiance-fusion-forecast/Notebooks/05_ground_hpo_optuna_v1.py:141: FutureWarning: The import path :class:`~optuna.storages.JournalFileOpenLock` has been deprecated in v4.0.0. This feature will be removed in v6.0.0. See https://github.com/optuna/optuna/releases/tag/v4.0.0. Use :class:`~optuna.storages.journal.JournalFileOpenLock` instead.
  file_storage = JournalFileStorage(str(log_path), lock_obj=JournalFileOpenLock(str(lock_path)))
/mnt/SOLARLAB/E_Ladino/Repo/irradiance-fusion-forecast/Notebooks/05_ground_hpo_optuna_v1.py:141: FutureWarning: JournalFileStorage has been deprecated in v4.0.0. This feature will be removed in v6.0.0. See https://github.com/optuna/optuna/releases/tag/v4.0.0. Use :class:`~optuna.storages.journal.JournalFileBackend` instead.
  file_storage = JournalFileStorage(str(log_path), lock_obj=JournalFileOpenLock(str(lock_path)))
[I 2025-10-06 10:46:39,571] A new study created in Journal with name: ground_trackB_transformer
Running Study B4 (Transformer)…
  0%|          | 0/40 [00:00<?, ?it/s]2025-10-06 10:46:42.372036: I external/local_xla/xla/stream_executor/cuda/cuda_asm_compiler.cc:397] ptxas warning : Registers are spilled to local memory in function 'gemm_fusion_dot_6', 332 bytes spill stores, 332 bytes spill loads

2025-10-06 10:46:42.491419: I external/local_xla/xla/stream_executor/cuda/cuda_asm_compiler.cc:397] ptxas warning : Registers are spilled to local memory in function 'gemm_fusion_dot_6', 360 bytes spill stores, 360 bytes spill loads

2025-10-06 10:46:42.752089: I external/local_xla/xla/stream_executor/cuda/cuda_asm_compiler.cc:397] ptxas warning : Registers are spilled to local memory in function 'gemm_fusion_dot_11', 144 bytes spill stores, 144 bytes spill loads

2025-10-06 10:46:44.618973: I external/local_xla/xla/stream_executor/cuda/cuda_asm_compiler.cc:397] ptxas warning : Registers are spilled to local memory in function 'gemm_fusion_dot_31', 8 bytes spill stores, 8 bytes spill loads

2025-10-06 10:46:44.727427: I external/local_xla/xla/stream_executor/cuda/cuda_asm_compiler.cc:397] ptxas warning : Registers are spilled to local memory in function 'gemm_fusion_dot_31', 20 bytes spill stores, 20 bytes spill loads

2025-10-06 10:46:45.010964: I external/local_xla/xla/stream_executor/cuda/cuda_asm_compiler.cc:397] ptxas warning : Registers are spilled to local memory in function 'gemm_fusion_dot_6', 168 bytes spill stores, 168 bytes spill loads

2025-10-06 10:46:45.117816: I external/local_xla/xla/stream_executor/cuda/cuda_asm_compiler.cc:397] ptxas warning : Registers are spilled to local memory in function 'gemm_fusion_dot_6', 200 bytes spill stores, 200 bytes spill loads

2025-10-06 10:46:47.081810: I external/local_xla/xla/stream_executor/cuda/cuda_asm_compiler.cc:397] ptxas warning : Registers are spilled to local memory in function 'gemm_fusion_dot_10', 20 bytes spill stores, 20 bytes spill loads

2025-10-06 10:46:47.126746: I external/local_xla/xla/stream_executor/cuda/cuda_asm_compiler.cc:397] ptxas warning : Registers are spilled to local memory in function 'gemm_fusion_dot_10', 8 bytes spill stores, 8 bytes spill loads

2025-10-06 10:46:47.153513: I external/local_xla/xla/stream_executor/cuda/cuda_asm_compiler.cc:397] ptxas warning : Registers are spilled to local memory in function 'gemm_fusion_dot_6', 168 bytes spill stores, 168 bytes spill loads

2025-10-06 10:46:47.211931: I external/local_xla/xla/stream_executor/cuda/cuda_asm_compiler.cc:397] ptxas warning : Registers are spilled to local memory in function 'gemm_fusion_dot_6', 200 bytes spill stores, 200 bytes spill loads

2025-10-06 10:47:00.296016: I external/local_xla/xla/stream_executor/cuda/cuda_asm_compiler.cc:397] ptxas warning : Registers are spilled to local memory in function 'gemm_fusion_dot_6', 200 bytes spill stores, 200 bytes spill loads

2025-10-06 10:47:00.335535: I external/local_xla/xla/stream_executor/cuda/cuda_asm_compiler.cc:397] ptxas warning : Registers are spilled to local memory in function 'gemm_fusion_dot_6', 360 bytes spill stores, 360 bytes spill loads

2025-10-06 10:47:00.999281: I external/local_xla/xla/stream_executor/cuda/cuda_asm_compiler.cc:397] ptxas warning : Registers are spilled to local memory in function 'gemm_fusion_dot_10', 8 bytes spill stores, 8 bytes spill loads

2025-10-06 10:47:01.049432: I external/local_xla/xla/stream_executor/cuda/cuda_asm_compiler.cc:397] ptxas warning : Registers are spilled to local memory in function 'gemm_fusion_dot_10', 20 bytes spill stores, 20 bytes spill loads

2025-10-06 10:47:01.112656: I external/local_xla/xla/stream_executor/cuda/cuda_asm_compiler.cc:397] ptxas warning : Registers are spilled to local memory in function 'gemm_fusion_dot_6', 200 bytes spill stores, 200 bytes spill loads

2025-10-06 10:47:01.177573: I external/local_xla/xla/stream_executor/cuda/cuda_asm_compiler.cc:397] ptxas warning : Registers are spilled to local memory in function 'gemm_fusion_dot_6', 168 bytes spill stores, 168 bytes spill loads

