Best trial: 1. Best value: 133.441:  10%|█         | 4/40 [02:53<24:45, 41.26s/it]Best trial: 4. Best value: 133.315:  10%|█         | 4/40 [02:53<24:45, 41.26s/it]Best trial: 4. Best value: 133.315:  12%|█▎        | 5/40 [02:53<22:06, 37.91s/it]                                                                                  [I 2025-10-06 10:49:49,082] Trial 5 finished with value: 132.05679856362943 and parameters: {'seq_len': 18, 'd_model': 64, 'heads': 2, 'ff_dim': 64, 'att_dropout': 0.1281323365878769, 'dropout': 0.32720590636899727, 'lr': 0.0026328806385787135, 'batch': 128, 'epochs': 57}. Best is trial 5 with value: 132.05679856362943.
Best trial: 4. Best value: 133.315:  12%|█▎        | 5/40 [03:09<22:06, 37.91s/it]Best trial: 5. Best value: 132.057:  12%|█▎        | 5/40 [03:09<22:06, 37.91s/it]Best trial: 5. Best value: 132.057:  15%|█▌        | 6/40 [03:09<17:17, 30.51s/it]2025-10-06 10:49:52.102135: I external/local_xla/xla/stream_executor/cuda/cuda_asm_compiler.cc:397] ptxas warning : Registers are spilled to local memory in function 'gemm_fusion_dot_2431', 24 bytes spill stores, 24 bytes spill loads

2025-10-06 10:49:52.206400: I external/local_xla/xla/stream_executor/cuda/cuda_asm_compiler.cc:397] ptxas warning : Registers are spilled to local memory in function 'gemm_fusion_dot_11', 136 bytes spill stores, 176 bytes spill loads

2025-10-06 10:49:52.264880: I external/local_xla/xla/stream_executor/cuda/cuda_asm_compiler.cc:397] ptxas warning : Registers are spilled to local memory in function 'gemm_fusion_dot_2431', 8 bytes spill stores, 8 bytes spill loads

2025-10-06 10:49:52.318927: I external/local_xla/xla/stream_executor/cuda/cuda_asm_compiler.cc:397] ptxas warning : Registers are spilled to local memory in function 'gemm_fusion_dot_6', 760 bytes spill stores, 836 bytes spill loads

2025-10-06 10:49:52.320026: I external/local_xla/xla/stream_executor/cuda/cuda_asm_compiler.cc:397] ptxas warning : Registers are spilled to local memory in function 'gemm_fusion_dot_19', 8 bytes spill stores, 8 bytes spill loads

2025-10-06 10:49:52.360295: I external/local_xla/xla/stream_executor/cuda/cuda_asm_compiler.cc:397] ptxas warning : Registers are spilled to local memory in function 'gemm_fusion_dot_2431', 8 bytes spill stores, 8 bytes spill loads

2025-10-06 10:49:52.390317: I external/local_xla/xla/stream_executor/cuda/cuda_asm_compiler.cc:397] ptxas warning : Registers are spilled to local memory in function 'gemm_fusion_dot_11', 92 bytes spill stores, 92 bytes spill loads

2025-10-06 10:49:54.748249: I external/local_xla/xla/stream_executor/cuda/cuda_asm_compiler.cc:397] ptxas warning : Registers are spilled to local memory in function 'gemm_fusion_dot_31', 8 bytes spill stores, 8 bytes spill loads

2025-10-06 10:49:54.754254: I external/local_xla/xla/stream_executor/cuda/cuda_asm_compiler.cc:397] ptxas warning : Registers are spilled to local memory in function 'gemm_fusion_dot_6', 12 bytes spill stores, 12 bytes spill loads

2025-10-06 10:49:54.794194: I external/local_xla/xla/stream_executor/cuda/cuda_asm_compiler.cc:397] ptxas warning : Registers are spilled to local memory in function 'gemm_fusion_dot_31', 20 bytes spill stores, 20 bytes spill loads

2025-10-06 10:49:55.321131: I external/local_xla/xla/stream_executor/cuda/cuda_asm_compiler.cc:397] ptxas warning : Registers are spilled to local memory in function 'gemm_fusion_dot_6', 816 bytes spill stores, 956 bytes spill loads

2025-10-06 10:49:57.462078: I external/local_xla/xla/stream_executor/cuda/cuda_asm_compiler.cc:397] ptxas warning : Registers are spilled to local memory in function 'gemm_fusion_dot_10', 8 bytes spill stores, 8 bytes spill loads

2025-10-06 10:49:57.475111: I external/local_xla/xla/stream_executor/cuda/cuda_asm_compiler.cc:397] ptxas warning : Registers are spilled to local memory in function 'gemm_fusion_dot_10', 20 bytes spill stores, 20 bytes spill loads

2025-10-06 10:49:57.506334: I external/local_xla/xla/stream_executor/cuda/cuda_asm_compiler.cc:397] ptxas warning : Registers are spilled to local memory in function 'gemm_fusion_dot_6', 12 bytes spill stores, 12 bytes spill loads

2025-10-06 10:49:57.734568: I external/local_xla/xla/stream_executor/cuda/cuda_asm_compiler.cc:397] ptxas warning : Registers are spilled to local memory in function 'gemm_fusion_dot_6', 816 bytes spill stores, 956 bytes spill loads

2025-10-06 10:50:26.555934: I external/local_xla/xla/stream_executor/cuda/cuda_asm_compiler.cc:397] ptxas warning : Registers are spilled to local memory in function 'gemm_fusion_dot_10', 40 bytes spill stores, 40 bytes spill loads

2025-10-06 10:50:26.831851: I external/local_xla/xla/stream_executor/cuda/cuda_asm_compiler.cc:397] ptxas warning : Registers are spilled to local memory in function 'gemm_fusion_dot_6', 760 bytes spill stores, 836 bytes spill loads

                                                                                  [I 2025-10-06 10:50:27,726] Trial 6 finished with value: 131.929890827477 and parameters: {'seq_len': 18, 'd_model': 128, 'heads': 2, 'ff_dim': 192, 'att_dropout': 0.15080370696865844, 'dropout': 0.02059150049999574, 'lr': 0.00018041096636818932, 'batch': 64, 'epochs': 79}. Best is trial 6 with value: 131.929890827477.
Best trial: 5. Best value: 132.057:  15%|█▌        | 6/40 [03:48<17:17, 30.51s/it]Best trial: 6. Best value: 131.93:  15%|█▌        | 6/40 [03:48<17:17, 30.51s/it] Best trial: 6. Best value: 131.93:  18%|█▊        | 7/40 [03:48<18:14, 33.17s/it]                                                                                 [I 2025-10-06 10:50:55,740] Trial 7 finished with value: 234.58667940923243 and parameters: {'seq_len': 6, 'd_model': 64, 'heads': 2, 'ff_dim': 64, 'att_dropout': 0.17726788295647253, 'dropout': 0.271025744736913, 'lr': 5.396916045063646e-05, 'batch': 256, 'epochs': 54}. Best is trial 6 with value: 131.929890827477.
Best trial: 6. Best value: 131.93:  18%|█▊        | 7/40 [04:16<18:14, 33.17s/it]Best trial: 6. Best value: 131.93:  18%|█▊        | 7/40 [04:16<18:14, 33.17s/it]Best trial: 6. Best value: 131.93:  20%|██        | 8/40 [04:16<16:48, 31.53s/it]2025-10-06 10:50:58.583144: I external/local_xla/xla/stream_executor/cuda/cuda_asm_compiler.cc:397] ptxas warning : Registers are spilled to local memory in function 'gemm_fusion_dot_31', 52 bytes spill stores, 52 bytes spill loads

2025-10-06 10:50:58.735336: I external/local_xla/xla/stream_executor/cuda/cuda_asm_compiler.cc:397] ptxas warning : Registers are spilled to local memory in function 'gemm_fusion_dot_31', 56 bytes spill stores, 56 bytes spill loads

2025-10-06 10:50:58.913861: I external/local_xla/xla/stream_executor/cuda/cuda_asm_compiler.cc:397] ptxas warning : Registers are spilled to local memory in function 'gemm_fusion_dot_11', 132 bytes spill stores, 132 bytes spill loads

2025-10-06 10:50:58.935348: I external/local_xla/xla/stream_executor/cuda/cuda_asm_compiler.cc:397] ptxas warning : Registers are spilled to local memory in function 'gemm_fusion_dot_11', 32 bytes spill stores, 32 bytes spill loads

2025-10-06 10:50:58.992234: I external/local_xla/xla/stream_executor/cuda/cuda_asm_compiler.cc:397] ptxas warning : Registers are spilled to local memory in function 'gemm_fusion_dot_6', 4 bytes spill stores, 4 bytes spill loads

2025-10-06 10:50:58.999291: I external/local_xla/xla/stream_executor/cuda/cuda_asm_compiler.cc:397] ptxas warning : Registers are spilled to local memory in function 'gemm_fusion_dot_19', 4 bytes spill stores, 4 bytes spill loads

2025-10-06 10:50:59.032407: I external/local_xla/xla/stream_executor/cuda/cuda_asm_compiler.cc:397] ptxas warning : Registers are spilled to local memory in function 'gemm_fusion_dot_19', 8 bytes spill stores, 8 bytes spill loads

2025-10-06 10:50:59.162844: I external/local_xla/xla/stream_executor/cuda/cuda_asm_compiler.cc:397] ptxas warning : Registers are spilled to local memory in function 'gemm_fusion_dot_11', 48 bytes spill stores, 48 bytes spill loads

2025-10-06 10:51:01.144785: I external/local_xla/xla/stream_executor/cuda/cuda_asm_compiler.cc:397] ptxas warning : Registers are spilled to local memory in function 'gemm_fusion_dot_31', 80 bytes spill stores, 80 bytes spill loads

2025-10-06 10:51:01.183389: I external/local_xla/xla/stream_executor/cuda/cuda_asm_compiler.cc:397] ptxas warning : Registers are spilled to local memory in function 'gemm_fusion_dot_31', 56 bytes spill stores, 56 bytes spill loads

2025-10-06 10:51:01.375216: I external/local_xla/xla/stream_executor/cuda/cuda_asm_compiler.cc:397] ptxas warning : Registers are spilled to local memory in function 'gemm_fusion_dot_6', 56 bytes spill stores, 56 bytes spill loads

2025-10-06 10:51:01.421620: I external/local_xla/xla/stream_executor/cuda/cuda_asm_compiler.cc:397] ptxas warning : Registers are spilled to local memory in function 'gemm_fusion_dot_6', 64 bytes spill stores, 64 bytes spill loads

2025-10-06 10:51:03.375318: I external/local_xla/xla/stream_executor/cuda/cuda_asm_compiler.cc:397] ptxas warning : Registers are spilled to local memory in function 'gemm_fusion_dot_10', 56 bytes spill stores, 56 bytes spill loads

2025-10-06 10:51:03.392445: I external/local_xla/xla/stream_executor/cuda/cuda_asm_compiler.cc:397] ptxas warning : Registers are spilled to local memory in function 'gemm_fusion_dot_10', 80 bytes spill stores, 80 bytes spill loads

2025-10-06 10:51:03.443250: I external/local_xla/xla/stream_executor/cuda/cuda_asm_compiler.cc:397] ptxas warning : Registers are spilled to local memory in function 'gemm_fusion_dot_6', 64 bytes spill stores, 64 bytes spill loads

2025-10-06 10:51:03.453892: I external/local_xla/xla/stream_executor/cuda/cuda_asm_compiler.cc:397] ptxas warning : Registers are spilled to local memory in function 'gemm_fusion_dot_6', 56 bytes spill stores, 56 bytes spill loads

                                                                                 [I 2025-10-06 10:51:08,376] Trial 8 pruned. Trial was pruned at epoch 11.
Best trial: 6. Best value: 131.93:  20%|██        | 8/40 [04:28<16:48, 31.53s/it]Best trial: 6. Best value: 131.93:  20%|██        | 8/40 [04:28<16:48, 31.53s/it]Best trial: 6. Best value: 131.93:  22%|██▎       | 9/40 [04:28<13:14, 25.62s/it]2025-10-06 10:51:11.262453: I external/local_xla/xla/stream_executor/cuda/cuda_asm_compiler.cc:397] ptxas warning : Registers are spilled to local memory in function 'gemm_fusion_dot_6', 24 bytes spill stores, 24 bytes spill loads

2025-10-06 10:51:13.072473: I external/local_xla/xla/stream_executor/cuda/cuda_asm_compiler.cc:397] ptxas warning : Registers are spilled to local memory in function 'gemm_fusion_dot_6', 12 bytes spill stores, 12 bytes spill loads

2025-10-06 10:51:13.196902: I external/local_xla/xla/stream_executor/cuda/cuda_asm_compiler.cc:397] ptxas warning : Registers are spilled to local memory in function 'gemm_fusion_dot_6', 32 bytes spill stores, 32 bytes spill loads

2025-10-06 10:51:14.990387: I external/local_xla/xla/stream_executor/cuda/cuda_asm_compiler.cc:397] ptxas warning : Registers are spilled to local memory in function 'gemm_fusion_dot_6', 12 bytes spill stores, 12 bytes spill loads

2025-10-06 10:51:15.034609: I external/local_xla/xla/stream_executor/cuda/cuda_asm_compiler.cc:397] ptxas warning : Registers are spilled to local memory in function 'gemm_fusion_dot_6', 32 bytes spill stores, 32 bytes spill loads

                                                                                 [I 2025-10-06 10:51:17,876] Trial 9 pruned. Trial was pruned at epoch 5.
Best trial: 6. Best value: 131.93:  22%|██▎       | 9/40 [04:38<13:14, 25.62s/it]Best trial: 6. Best value: 131.93:  22%|██▎       | 9/40 [04:38<13:14, 25.62s/it]Best trial: 6. Best value: 131.93:  25%|██▌       | 10/40 [04:38<10:19, 20.65s/it]2025-10-06 10:51:20.778664: I external/local_xla/xla/stream_executor/cuda/cuda_asm_compiler.cc:397] ptxas warning : Registers are spilled to local memory in function 'gemm_fusion_dot_11', 8 bytes spill stores, 8 bytes spill loads

2025-10-06 10:51:21.038014: I external/local_xla/xla/stream_executor/cuda/cuda_asm_compiler.cc:397] ptxas warning : Registers are spilled to local memory in function 'gemm_fusion_dot_6', 432 bytes spill stores, 432 bytes spill loads

2025-10-06 10:51:23.332461: I external/local_xla/xla/stream_executor/cuda/cuda_asm_compiler.cc:397] ptxas warning : Registers are spilled to local memory in function 'gemm_fusion_dot_6', 440 bytes spill stores, 440 bytes spill loads

2025-10-06 10:51:25.361076: I external/local_xla/xla/stream_executor/cuda/cuda_asm_compiler.cc:397] ptxas warning : Registers are spilled to local memory in function 'gemm_fusion_dot_6', 440 bytes spill stores, 440 bytes spill loads

2025-10-06 10:51:46.182340: I external/local_xla/xla/stream_executor/cuda/cuda_asm_compiler.cc:397] ptxas warning : Registers are spilled to local memory in function 'gemm_fusion_dot_6', 440 bytes spill stores, 440 bytes spill loads

                                                                                  [I 2025-10-06 10:51:46,944] Trial 10 finished with value: 132.0208464836141 and parameters: {'seq_len': 18, 'd_model': 32, 'heads': 4, 'ff_dim': 192, 'att_dropout': 0.23550885807204874, 'dropout': 0.01549007998447316, 'lr': 0.00415443048306104, 'batch': 64, 'epochs': 70}. Best is trial 6 with value: 131.929890827477.
Best trial: 6. Best value: 131.93:  25%|██▌       | 10/40 [05:07<10:19, 20.65s/it]Best trial: 6. Best value: 131.93:  25%|██▌       | 10/40 [05:07<10:19, 20.65s/it]Best trial: 6. Best value: 131.93:  28%|██▊       | 11/40 [05:07<11:13, 23.22s/it]                                                                                  [I 2025-10-06 10:52:09,620] Trial 11 finished with value: 132.6293737497467 and parameters: {'seq_len': 18, 'd_model': 32, 'heads': 4, 'ff_dim': 192, 'att_dropout': 0.2599609337918799, 'dropout': 0.007346617898812944, 'lr': 0.00386837743330195, 'batch': 64, 'epochs': 69}. Best is trial 6 with value: 131.929890827477.
Best trial: 6. Best value: 131.93:  28%|██▊       | 11/40 [05:30<11:13, 23.22s/it]Best trial: 6. Best value: 131.93:  28%|██▊       | 11/40 [05:30<11:13, 23.22s/it]Best trial: 6. Best value: 131.93:  30%|███       | 12/40 [05:30<10:45, 23.06s/it]                                                                                  [I 2025-10-06 10:52:26,364] Trial 12 finished with value: 133.2045463633843 and parameters: {'seq_len': 18, 'd_model': 32, 'heads': 4, 'ff_dim': 192, 'att_dropout': 0.22980199251780561, 'dropout': 0.018137961873729402, 'lr': 0.0015348685222884215, 'batch': 64, 'epochs': 71}. Best is trial 6 with value: 131.929890827477.
Best trial: 6. Best value: 131.93:  30%|███       | 12/40 [05:46<10:45, 23.06s/it]Best trial: 6. Best value: 131.93:  30%|███       | 12/40 [05:46<10:45, 23.06s/it]Best trial: 6. Best value: 131.93:  32%|███▎      | 13/40 [05:46<09:30, 21.14s/it]                                                                                  [I 2025-10-06 10:52:36,285] Trial 13 pruned. Trial was pruned at epoch 5.
Best trial: 6. Best value: 131.93:  32%|███▎      | 13/40 [05:56<09:30, 21.14s/it]Best trial: 6. Best value: 131.93:  32%|███▎      | 13/40 [05:56<09:30, 21.14s/it]Best trial: 6. Best value: 131.93:  35%|███▌      | 14/40 [05:56<07:41, 17.75s/it]                                                                                  [I 2025-10-06 10:52:55,855] Trial 14 finished with value: 132.850303443387 and parameters: {'seq_len': 18, 'd_model': 128, 'heads': 8, 'ff_dim': 192, 'att_dropout': 0.2996376880302051, 'dropout': 0.0653514373768068, 'lr': 0.0013695587977945345, 'batch': 64, 'epochs': 66}. Best is trial 6 with value: 131.929890827477.
Best trial: 6. Best value: 131.93:  35%|███▌      | 14/40 [06:16<07:41, 17.75s/it]Best trial: 6. Best value: 131.93:  35%|███▌      | 14/40 [06:16<07:41, 17.75s/it]Best trial: 6. Best value: 131.93:  38%|███▊      | 15/40 [06:16<07:37, 18.30s/it]                                                                                  [I 2025-10-06 10:53:24,299] Trial 15 finished with value: 131.24691216605822 and parameters: {'seq_len': 18, 'd_model': 32, 'heads': 2, 'ff_dim': 96, 'att_dropout': 0.12498382318543041, 'dropout': 0.21196884055580936, 'lr': 0.004548007664220133, 'batch': 64, 'epochs': 79}. Best is trial 15 with value: 131.24691216605822.
Best trial: 6. Best value: 131.93:  38%|███▊      | 15/40 [06:44<07:37, 18.30s/it]Best trial: 15. Best value: 131.247:  38%|███▊      | 15/40 [06:44<07:37, 18.30s/it]Best trial: 15. Best value: 131.247:  40%|████      | 16/40 [06:44<08:32, 21.35s/it]2025-10-06 10:53:27.166175: I external/local_xla/xla/stream_executor/cuda/cuda_asm_compiler.cc:397] ptxas warning : Registers are spilled to local memory in function 'gemm_fusion_dot_2431', 8 bytes spill stores, 8 bytes spill loads

2025-10-06 10:53:27.180448: I external/local_xla/xla/stream_executor/cuda/cuda_asm_compiler.cc:397] ptxas warning : Registers are spilled to local memory in function 'gemm_fusion_dot_6', 76 bytes spill stores, 76 bytes spill loads

2025-10-06 10:53:27.211665: I external/local_xla/xla/stream_executor/cuda/cuda_asm_compiler.cc:397] ptxas warning : Registers are spilled to local memory in function 'gemm_fusion_dot_6', 52 bytes spill stores, 52 bytes spill loads

2025-10-06 10:53:29.439446: I external/local_xla/xla/stream_executor/cuda/cuda_asm_compiler.cc:397] ptxas warning : Registers are spilled to local memory in function 'gemm_fusion_dot_6', 72 bytes spill stores, 72 bytes spill loads

2025-10-06 10:53:29.479373: I external/local_xla/xla/stream_executor/cuda/cuda_asm_compiler.cc:397] ptxas warning : Registers are spilled to local memory in function 'gemm_fusion_dot_6', 48 bytes spill stores, 48 bytes spill loads

2025-10-06 10:53:31.384453: I external/local_xla/xla/stream_executor/cuda/cuda_asm_compiler.cc:397] ptxas warning : Registers are spilled to local memory in function 'gemm_fusion_dot_6', 72 bytes spill stores, 72 bytes spill loads

2025-10-06 10:53:31.385857: I external/local_xla/xla/stream_executor/cuda/cuda_asm_compiler.cc:397] ptxas warning : Registers are spilled to local memory in function 'gemm_fusion_dot_6', 48 bytes spill stores, 48 bytes spill loads

                                                                                    [I 2025-10-06 10:53:36,623] Trial 16 pruned. Trial was pruned at epoch 5.
Best trial: 15. Best value: 131.247:  40%|████      | 16/40 [06:57<08:32, 21.35s/it]Best trial: 15. Best value: 131.247:  40%|████      | 16/40 [06:57<08:32, 21.35s/it]Best trial: 15. Best value: 131.247:  42%|████▎     | 17/40 [06:57<07:08, 18.64s/it]2025-10-06 10:53:39.530367: I external/local_xla/xla/stream_executor/cuda/cuda_asm_compiler.cc:397] ptxas warning : Registers are spilled to local memory in function 'gemm_fusion_dot_6', 52 bytes spill stores, 52 bytes spill loads

2025-10-06 10:53:39.593604: I external/local_xla/xla/stream_executor/cuda/cuda_asm_compiler.cc:397] ptxas warning : Registers are spilled to local memory in function 'gemm_fusion_dot_6', 76 bytes spill stores, 76 bytes spill loads

2025-10-06 10:53:41.781976: I external/local_xla/xla/stream_executor/cuda/cuda_asm_compiler.cc:397] ptxas warning : Registers are spilled to local memory in function 'gemm_fusion_dot_31', 8 bytes spill stores, 8 bytes spill loads

2025-10-06 10:53:41.867679: I external/local_xla/xla/stream_executor/cuda/cuda_asm_compiler.cc:397] ptxas warning : Registers are spilled to local memory in function 'gemm_fusion_dot_6', 72 bytes spill stores, 72 bytes spill loads

2025-10-06 10:53:41.987633: I external/local_xla/xla/stream_executor/cuda/cuda_asm_compiler.cc:397] ptxas warning : Registers are spilled to local memory in function 'gemm_fusion_dot_31', 20 bytes spill stores, 20 bytes spill loads

2025-10-06 10:53:42.216242: I external/local_xla/xla/stream_executor/cuda/cuda_asm_compiler.cc:397] ptxas warning : Registers are spilled to local memory in function 'gemm_fusion_dot_6', 48 bytes spill stores, 48 bytes spill loads

2025-10-06 10:53:44.041611: I external/local_xla/xla/stream_executor/cuda/cuda_asm_compiler.cc:397] ptxas warning : Registers are spilled to local memory in function 'gemm_fusion_dot_6', 72 bytes spill stores, 72 bytes spill loads

2025-10-06 10:53:44.091152: I external/local_xla/xla/stream_executor/cuda/cuda_asm_compiler.cc:397] ptxas warning : Registers are spilled to local memory in function 'gemm_fusion_dot_6', 48 bytes spill stores, 48 bytes spill loads

2025-10-06 10:54:02.140053: I external/local_xla/xla/stream_executor/cuda/cuda_asm_compiler.cc:397] ptxas warning : Registers are spilled to local memory in function 'gemm_fusion_dot_6', 52 bytes spill stores, 52 bytes spill loads

2025-10-06 10:54:02.181559: I external/local_xla/xla/stream_executor/cuda/cuda_asm_compiler.cc:397] ptxas warning : Registers are spilled to local memory in function 'gemm_fusion_dot_6', 76 bytes spill stores, 76 bytes spill loads

                                                                                    [I 2025-10-06 10:54:03,038] Trial 17 finished with value: 133.5225139021506 and parameters: {'seq_len': 12, 'd_model': 128, 'heads': 2, 'ff_dim': 96, 'att_dropout': 0.15653305631911868, 'dropout': 0.21603800804543755, 'lr': 0.00026718848574912627, 'batch': 64, 'epochs': 94}. Best is trial 15 with value: 131.24691216605822.
