Best trial: 21. Best value: 129.708:  65%|██████▌   | 26/40 [05:54<01:48,  7.77s/it]Best trial: 32. Best value: 129.699:  65%|██████▌   | 26/40 [05:54<01:48,  7.77s/it]Best trial: 32. Best value: 129.699:  68%|██████▊   | 27/40 [05:54<01:41,  7.84s/it]                                                                                    [I 2025-10-06 09:45:05,317] Trial 33 finished with value: 129.9111775887664 and parameters: {'n1': 320, 'n2': 128, 'do1': 0.448742883390127, 'do2': 0.18257860783103713, 'lr': 0.002144615818207625, 'l2': 6.810974329344077e-06, 'act': 'gelu', 'batch': 512, 'epochs': 40}. Best is trial 32 with value: 129.6991561026902.
Best trial: 32. Best value: 129.699:  68%|██████▊   | 27/40 [06:03<01:41,  7.84s/it]Best trial: 32. Best value: 129.699:  68%|██████▊   | 27/40 [06:03<01:41,  7.84s/it]Best trial: 32. Best value: 129.699:  70%|███████   | 28/40 [06:03<01:39,  8.25s/it]                                                                                    [I 2025-10-06 09:45:15,927] Trial 34 finished with value: 129.90989966607626 and parameters: {'n1': 384, 'n2': 160, 'do1': 0.38536856409222636, 'do2': 0.27519405094006366, 'lr': 0.0035519802736144477, 'l2': 1.071253535826957e-06, 'act': 'gelu', 'batch': 512, 'epochs': 68}. Best is trial 32 with value: 129.6991561026902.
Best trial: 32. Best value: 129.699:  70%|███████   | 28/40 [06:14<01:39,  8.25s/it]Best trial: 32. Best value: 129.699:  70%|███████   | 28/40 [06:14<01:39,  8.25s/it]Best trial: 32. Best value: 129.699:  72%|███████▎  | 29/40 [06:14<01:38,  8.96s/it]                                                                                    [I 2025-10-06 09:45:23,443] Trial 35 finished with value: 129.96126977151692 and parameters: {'n1': 448, 'n2': 192, 'do1': 0.33712435689658354, 'do2': 0.24298096306322461, 'lr': 0.0023860795833066844, 'l2': 1.7469193055629813e-05, 'act': 'gelu', 'batch': 512, 'epochs': 87}. Best is trial 32 with value: 129.6991561026902.
Best trial: 32. Best value: 129.699:  72%|███████▎  | 29/40 [06:22<01:38,  8.96s/it]Best trial: 32. Best value: 129.699:  72%|███████▎  | 29/40 [06:22<01:38,  8.96s/it]Best trial: 32. Best value: 129.699:  75%|███████▌  | 30/40 [06:22<01:25,  8.53s/it]                                                                                    [I 2025-10-06 09:45:32,421] Trial 36 finished with value: 130.0000751201706 and parameters: {'n1': 320, 'n2': 128, 'do1': 0.44442784772843197, 'do2': 0.3298196651297162, 'lr': 0.004768126836731413, 'l2': 3.1815334925087537e-06, 'act': 'gelu', 'batch': 512, 'epochs': 49}. Best is trial 32 with value: 129.6991561026902.
Best trial: 32. Best value: 129.699:  75%|███████▌  | 30/40 [06:31<01:25,  8.53s/it]Best trial: 32. Best value: 129.699:  75%|███████▌  | 30/40 [06:31<01:25,  8.53s/it]Best trial: 32. Best value: 129.699:  78%|███████▊  | 31/40 [06:31<01:17,  8.66s/it]                                                                                    [I 2025-10-06 09:45:45,116] Trial 37 finished with value: 130.14070660490898 and parameters: {'n1': 384, 'n2': 160, 'do1': 0.38452061957725425, 'do2': 0.1132863750815153, 'lr': 0.0014465691936696502, 'l2': 0.00045135497521755575, 'act': 'gelu', 'batch': 128, 'epochs': 59}. Best is trial 32 with value: 129.6991561026902.
Best trial: 32. Best value: 129.699:  78%|███████▊  | 31/40 [06:43<01:17,  8.66s/it]Best trial: 32. Best value: 129.699:  78%|███████▊  | 31/40 [06:43<01:17,  8.66s/it]Best trial: 32. Best value: 129.699:  80%|████████  | 32/40 [06:43<01:18,  9.87s/it]2025-10-06 09:45:47.188075: I external/local_xla/xla/stream_executor/cuda/cuda_asm_compiler.cc:397] ptxas warning : Registers are spilled to local memory in function 'gemm_fusion_dot_48', 264 bytes spill stores, 264 bytes spill loads

2025-10-06 09:45:47.406588: I external/local_xla/xla/stream_executor/cuda/cuda_asm_compiler.cc:397] ptxas warning : Registers are spilled to local memory in function 'gemm_fusion_dot_48', 1888 bytes spill stores, 1636 bytes spill loads

2025-10-06 09:45:47.760667: I external/local_xla/xla/stream_executor/cuda/cuda_asm_compiler.cc:397] ptxas warning : Registers are spilled to local memory in function 'gemm_fusion_dot_48', 12 bytes spill stores, 12 bytes spill loads

2025-10-06 09:45:47.835012: I external/local_xla/xla/stream_executor/cuda/cuda_asm_compiler.cc:397] ptxas warning : Registers are spilled to local memory in function 'gemm_fusion_dot_48', 268 bytes spill stores, 268 bytes spill loads

2025-10-06 09:45:48.059267: I external/local_xla/xla/stream_executor/cuda/cuda_asm_compiler.cc:397] ptxas warning : Registers are spilled to local memory in function 'gemm_fusion_dot_48', 1240 bytes spill stores, 1036 bytes spill loads

                                                                                    [I 2025-10-06 09:45:49,324] Trial 38 pruned. Trial was pruned at epoch 5.
Best trial: 32. Best value: 129.699:  80%|████████  | 32/40 [06:47<01:18,  9.87s/it]Best trial: 32. Best value: 129.699:  80%|████████  | 32/40 [06:47<01:18,  9.87s/it]Best trial: 32. Best value: 129.699:  82%|████████▎ | 33/40 [06:47<00:57,  8.17s/it]                                                                                    [I 2025-10-06 09:45:59,987] Trial 39 finished with value: 129.83400610250382 and parameters: {'n1': 448, 'n2': 192, 'do1': 0.28071428880717153, 'do2': 0.30800413786498493, 'lr': 0.002030757687346674, 'l2': 1.7621278369079448e-06, 'act': 'gelu', 'batch': 256, 'epochs': 58}. Best is trial 32 with value: 129.6991561026902.
Best trial: 32. Best value: 129.699:  82%|████████▎ | 33/40 [06:58<00:57,  8.17s/it]Best trial: 32. Best value: 129.699:  82%|████████▎ | 33/40 [06:58<00:57,  8.17s/it]Best trial: 32. Best value: 129.699:  85%|████████▌ | 34/40 [06:58<00:53,  8.92s/it]2025-10-06 09:46:02.140201: I external/local_xla/xla/stream_executor/cuda/cuda_asm_compiler.cc:397] ptxas warning : Registers are spilled to local memory in function 'gemm_fusion_dot_48', 24 bytes spill stores, 24 bytes spill loads

2025-10-06 09:46:02.298886: I external/local_xla/xla/stream_executor/cuda/cuda_asm_compiler.cc:397] ptxas warning : Registers are spilled to local memory in function 'gemm_fusion_dot_48_0', 776 bytes spill stores, 724 bytes spill loads

2025-10-06 09:46:02.364078: I external/local_xla/xla/stream_executor/cuda/cuda_asm_compiler.cc:397] ptxas warning : Registers are spilled to local memory in function 'gemm_fusion_dot_48', 928 bytes spill stores, 884 bytes spill loads

2025-10-06 09:46:02.367350: I external/local_xla/xla/stream_executor/cuda/cuda_asm_compiler.cc:397] ptxas warning : Registers are spilled to local memory in function 'gemm_fusion_dot_48', 1032 bytes spill stores, 1012 bytes spill loads

2025-10-06 09:46:02.814225: I external/local_xla/xla/stream_executor/cuda/cuda_asm_compiler.cc:397] ptxas warning : Registers are spilled to local memory in function 'gemm_fusion_dot_48', 48 bytes spill stores, 48 bytes spill loads

2025-10-06 09:46:02.977411: I external/local_xla/xla/stream_executor/cuda/cuda_asm_compiler.cc:397] ptxas warning : Registers are spilled to local memory in function 'gemm_fusion_dot_48_0', 1044 bytes spill stores, 732 bytes spill loads

2025-10-06 09:46:03.067573: I external/local_xla/xla/stream_executor/cuda/cuda_asm_compiler.cc:397] ptxas warning : Registers are spilled to local memory in function 'gemm_fusion_dot_48', 996 bytes spill stores, 852 bytes spill loads

2025-10-06 09:46:03.091328: I external/local_xla/xla/stream_executor/cuda/cuda_asm_compiler.cc:397] ptxas warning : Registers are spilled to local memory in function 'gemm_fusion_dot_48', 1148 bytes spill stores, 948 bytes spill loads

                                                                                    [I 2025-10-06 09:46:05,024] Trial 40 pruned. Trial was pruned at epoch 5.
Best trial: 32. Best value: 129.699:  85%|████████▌ | 34/40 [07:03<00:53,  8.92s/it]Best trial: 32. Best value: 129.699:  85%|████████▌ | 34/40 [07:03<00:53,  8.92s/it]Best trial: 32. Best value: 129.699:  88%|████████▊ | 35/40 [07:03<00:38,  7.75s/it]                                                                                    [I 2025-10-06 09:46:07,836] Trial 41 pruned. Trial was pruned at epoch 5.
Best trial: 32. Best value: 129.699:  88%|████████▊ | 35/40 [07:06<00:38,  7.75s/it]Best trial: 32. Best value: 129.699:  88%|████████▊ | 35/40 [07:06<00:38,  7.75s/it]Best trial: 32. Best value: 129.699:  90%|█████████ | 36/40 [07:06<00:25,  6.27s/it]                                                                                    [I 2025-10-06 09:46:11,056] Trial 42 pruned. Trial was pruned at epoch 5.
Best trial: 32. Best value: 129.699:  90%|█████████ | 36/40 [07:09<00:25,  6.27s/it]Best trial: 32. Best value: 129.699:  90%|█████████ | 36/40 [07:09<00:25,  6.27s/it]Best trial: 32. Best value: 129.699:  92%|█████████▎| 37/40 [07:09<00:16,  5.36s/it]                                                                                    [I 2025-10-06 09:46:22,277] Trial 43 finished with value: 129.81802166879604 and parameters: {'n1': 384, 'n2': 160, 'do1': 0.4703597814896421, 'do2': 0.329151844439126, 'lr': 0.0028929435034253737, 'l2': 6.330410746237509e-06, 'act': 'gelu', 'batch': 512, 'epochs': 55}. Best is trial 32 with value: 129.6991561026902.
Best trial: 32. Best value: 129.699:  92%|█████████▎| 37/40 [07:20<00:16,  5.36s/it]Best trial: 32. Best value: 129.699:  92%|█████████▎| 37/40 [07:20<00:16,  5.36s/it]Best trial: 32. Best value: 129.699:  95%|█████████▌| 38/40 [07:20<00:14,  7.12s/it]                                                                                    [I 2025-10-06 09:46:31,695] Trial 44 finished with value: 129.7948351004384 and parameters: {'n1': 320, 'n2': 128, 'do1': 0.39372309062127975, 'do2': 0.2587210013356572, 'lr': 0.0040141093038205565, 'l2': 5.859484746084697e-05, 'act': 'gelu', 'batch': 512, 'epochs': 88}. Best is trial 32 with value: 129.6991561026902.
Best trial: 32. Best value: 129.699:  95%|█████████▌| 38/40 [07:30<00:14,  7.12s/it]Best trial: 32. Best value: 129.699:  95%|█████████▌| 38/40 [07:30<00:14,  7.12s/it]Best trial: 32. Best value: 129.699:  98%|█████████▊| 39/40 [07:30<00:07,  7.81s/it]                                                                                    [I 2025-10-06 09:46:39,765] Trial 45 pruned. Trial was pruned at epoch 15.
Best trial: 32. Best value: 129.699:  98%|█████████▊| 39/40 [07:38<00:07,  7.81s/it]Best trial: 32. Best value: 129.699:  98%|█████████▊| 39/40 [07:38<00:07,  7.81s/it]Best trial: 32. Best value: 129.699: 100%|██████████| 40/40 [07:38<00:00,  7.89s/it]Best trial: 32. Best value: 129.699: 100%|██████████| 40/40 [07:38<00:00, 11.46s/it]
/home/e.ladino/miniconda3/envs/e_ladino/lib/python3.12/site-packages/keras/src/saving/saving_lib.py:797: UserWarning: Skipping variable loading for optimizer 'adam', because it has 2 variables whereas the saved optimizer has 14 variables. 
  saveable.load_own_variables(weights_store.get(inner_path))
Best MLP params: {'n1': 384, 'n2': 160, 'do1': 0.37294085185940923, 'do2': 0.29172869700977455, 'lr': 0.004763717990181229, 'l2': 7.275111101829076e-06, 'act': 'gelu', 'batch': 512, 'epochs': 64}
MLP test → RMSE: 135.5935 | MAE: 66.8857 | R2: 0.7228 | Skill: 0.309
/mnt/SOLARLAB/E_Ladino/Repo/irradiance-fusion-forecast/Notebooks/05_ground_hpo_optuna_v1.py:141: FutureWarning: The import path :class:`~optuna.storages.JournalFileOpenLock` has been deprecated in v4.0.0. This feature will be removed in v6.0.0. See https://github.com/optuna/optuna/releases/tag/v4.0.0. Use :class:`~optuna.storages.journal.JournalFileOpenLock` instead.
  file_storage = JournalFileStorage(str(log_path), lock_obj=JournalFileOpenLock(str(lock_path)))
/mnt/SOLARLAB/E_Ladino/Repo/irradiance-fusion-forecast/Notebooks/05_ground_hpo_optuna_v1.py:141: FutureWarning: JournalFileStorage has been deprecated in v4.0.0. This feature will be removed in v6.0.0. See https://github.com/optuna/optuna/releases/tag/v4.0.0. Use :class:`~optuna.storages.journal.JournalFileBackend` instead.
  file_storage = JournalFileStorage(str(log_path), lock_obj=JournalFileOpenLock(str(lock_path)))
[I 2025-10-06 09:46:40,105] A new study created in Journal with name: ground_trackB_lstm
Running Study B1 (LSTM)…
  0%|          | 0/40 [00:00<?, ?it/s]                                      [I 2025-10-06 09:47:34,118] Trial 0 finished with value: 256.02015606686126 and parameters: {'seq_len': 12, 'units': 32, 'dropout': 0.062397808134481064, 'lr': 6.533369619026643e-05, 'batch': 64, 'epochs': 41}. Best is trial 0 with value: 256.02015606686126.
  0%|          | 0/40 [00:54<?, ?it/s]Best trial: 0. Best value: 256.02:   0%|          | 0/40 [00:54<?, ?it/s]Best trial: 0. Best value: 256.02:   2%|▎         | 1/40 [00:54<35:06, 54.01s/it]                                                                                 [I 2025-10-06 09:47:54,691] Trial 1 finished with value: 203.21497045924053 and parameters: {'seq_len': 6, 'units': 32, 'dropout': 0.1216968971838151, 'lr': 0.0005603803105930283, 'batch': 256, 'epochs': 51}. Best is trial 1 with value: 203.21497045924053.
Best trial: 0. Best value: 256.02:   2%|▎         | 1/40 [01:14<35:06, 54.01s/it]Best trial: 1. Best value: 203.215:   2%|▎         | 1/40 [01:14<35:06, 54.01s/it]Best trial: 1. Best value: 203.215:   5%|▌         | 2/40 [01:14<21:45, 34.34s/it]                                                                                  [I 2025-10-06 09:48:31,219] Trial 2 finished with value: 145.4438116378624 and parameters: {'seq_len': 24, 'units': 32, 'dropout': 0.20569377536544464, 'lr': 0.000765242606091573, 'batch': 128, 'epochs': 45}. Best is trial 2 with value: 145.4438116378624.
Best trial: 1. Best value: 203.215:   5%|▌         | 2/40 [01:51<21:45, 34.34s/it]Best trial: 2. Best value: 145.444:   5%|▌         | 2/40 [01:51<21:45, 34.34s/it]Best trial: 2. Best value: 145.444:   8%|▊         | 3/40 [01:51<21:47, 35.34s/it]                                                                                  [I 2025-10-06 09:49:51,511] Trial 3 finished with value: 135.90947987079488 and parameters: {'seq_len': 12, 'units': 32, 'dropout': 0.2736932106048628, 'lr': 0.0003795552402641347, 'batch': 128, 'epochs': 113}. Best is trial 3 with value: 135.90947987079488.
Best trial: 2. Best value: 145.444:   8%|▊         | 3/40 [03:11<21:47, 35.34s/it]Best trial: 3. Best value: 135.909:   8%|▊         | 3/40 [03:11<21:47, 35.34s/it]Best trial: 3. Best value: 135.909:  10%|█         | 4/40 [03:11<31:51, 53.09s/it]                                                                                  [I 2025-10-06 09:50:12,946] Trial 4 finished with value: 132.2333918565012 and parameters: {'seq_len': 12, 'units': 96, 'dropout': 0.07394178221021082, 'lr': 0.004346495755569775, 'batch': 128, 'epochs': 88}. Best is trial 4 with value: 132.2333918565012.
Best trial: 3. Best value: 135.909:  10%|█         | 4/40 [03:32<31:51, 53.09s/it]Best trial: 4. Best value: 132.233:  10%|█         | 4/40 [03:32<31:51, 53.09s/it]Best trial: 4. Best value: 132.233:  12%|█▎        | 5/40 [03:32<24:18, 41.67s/it]                                                                                  [I 2025-10-06 09:52:07,113] Trial 5 finished with value: 133.77372745143197 and parameters: {'seq_len': 6, 'units': 64, 'dropout': 0.15547091587579281, 'lr': 0.0001744488327445185, 'batch': 64, 'epochs': 83}. Best is trial 4 with value: 132.2333918565012.
Best trial: 4. Best value: 132.233:  12%|█▎        | 5/40 [05:27<24:18, 41.67s/it]Best trial: 4. Best value: 132.233:  12%|█▎        | 5/40 [05:27<24:18, 41.67s/it]Best trial: 4. Best value: 132.233:  15%|█▌        | 6/40 [05:27<37:34, 66.32s/it]                                                                                  [I 2025-10-06 09:54:44,119] Trial 6 finished with value: 141.4069233409383 and parameters: {'seq_len': 24, 'units': 128, 'dropout': 0.07948627261366897, 'lr': 5.12878198709283e-05, 'batch': 64, 'epochs': 102}. Best is trial 4 with value: 132.2333918565012.
Best trial: 4. Best value: 132.233:  15%|█▌        | 6/40 [08:04<37:34, 66.32s/it]Best trial: 4. Best value: 132.233:  15%|█▌        | 6/40 [08:04<37:34, 66.32s/it]Best trial: 4. Best value: 132.233:  18%|█▊        | 7/40 [08:04<52:46, 95.97s/it]                                                                                  [I 2025-10-06 09:55:32,496] Trial 7 finished with value: 229.91241538899112 and parameters: {'seq_len': 24, 'units': 96, 'dropout': 0.13235920994105968, 'lr': 6.700183621677408e-05, 'batch': 256, 'epochs': 91}. Best is trial 4 with value: 132.2333918565012.
Best trial: 4. Best value: 132.233:  18%|█▊        | 7/40 [08:52<52:46, 95.97s/it]Best trial: 4. Best value: 132.233:  18%|█▊        | 7/40 [08:52<52:46, 95.97s/it]Best trial: 4. Best value: 132.233:  20%|██        | 8/40 [08:52<43:06, 80.82s/it]                                                                                  [I 2025-10-06 09:55:52,822] Trial 8 finished with value: 131.35028906515583 and parameters: {'seq_len': 6, 'units': 128, 'dropout': 0.2245108790277985, 'lr': 0.0017414233532634423, 'batch': 128, 'epochs': 42}. Best is trial 8 with value: 131.35028906515583.
Best trial: 4. Best value: 132.233:  20%|██        | 8/40 [09:12<43:06, 80.82s/it]Best trial: 8. Best value: 131.35:  20%|██        | 8/40 [09:12<43:06, 80.82s/it] Best trial: 8. Best value: 131.35:  22%|██▎       | 9/40 [09:12<31:59, 61.91s/it]                                                                                 [I 2025-10-06 09:56:30,283] Trial 9 finished with value: 173.4148295994319 and parameters: {'seq_len': 18, 'units': 96, 'dropout': 0.3630265895704372, 'lr': 0.00015759936475969445, 'batch': 128, 'epochs': 46}. Best is trial 8 with value: 131.35028906515583.
Best trial: 8. Best value: 131.35:  22%|██▎       | 9/40 [09:50<31:59, 61.91s/it]Best trial: 8. Best value: 131.35:  22%|██▎       | 9/40 [09:50<31:59, 61.91s/it]Best trial: 8. Best value: 131.35:  25%|██▌       | 10/40 [09:50<27:10, 54.36s/it]                                                                                  [I 2025-10-06 09:56:47,596] Trial 10 finished with value: 131.4275733293817 and parameters: {'seq_len': 6, 'units': 128, 'dropout': 0.2784471213433284, 'lr': 0.0027539578176416475, 'batch': 128, 'epochs': 65}. Best is trial 8 with value: 131.35028906515583.
Best trial: 8. Best value: 131.35:  25%|██▌       | 10/40 [10:07<27:10, 54.36s/it]Best trial: 8. Best value: 131.35:  25%|██▌       | 10/40 [10:07<27:10, 54.36s/it]Best trial: 8. Best value: 131.35:  28%|██▊       | 11/40 [10:07<20:47, 43.02s/it]                                                                                  [I 2025-10-06 09:57:03,860] Trial 11 finished with value: 130.55079381461073 and parameters: {'seq_len': 6, 'units': 128, 'dropout': 0.28709113645897344, 'lr': 0.003525724975766174, 'batch': 128, 'epochs': 64}. Best is trial 11 with value: 130.55079381461073.
Best trial: 8. Best value: 131.35:  28%|██▊       | 11/40 [10:23<20:47, 43.02s/it]Best trial: 11. Best value: 130.551:  28%|██▊       | 11/40 [10:23<20:47, 43.02s/it]Best trial: 11. Best value: 130.551:  30%|███       | 12/40 [10:23<16:16, 34.88s/it]                                                                                    [I 2025-10-06 09:57:24,961] Trial 12 finished with value: 131.16734748737966 and parameters: {'seq_len': 6, 'units': 128, 'dropout': 0.24394214564709016, 'lr': 0.001615337308674967, 'batch': 128, 'epochs': 65}. Best is trial 11 with value: 130.55079381461073.
Best trial: 11. Best value: 130.551:  30%|███       | 12/40 [10:44<16:16, 34.88s/it]Best trial: 11. Best value: 130.551:  30%|███       | 12/40 [10:44<16:16, 34.88s/it]Best trial: 11. Best value: 130.551:  32%|███▎      | 13/40 [10:44<13:49, 30.71s/it]                                                                                    [I 2025-10-06 09:57:45,610] Trial 13 finished with value: 133.1774104578175 and parameters: {'seq_len': 6, 'units': 128, 'dropout': 0.38146553658251803, 'lr': 0.0011968595971406895, 'batch': 128, 'epochs': 67}. Best is trial 11 with value: 130.55079381461073.
Best trial: 11. Best value: 130.551:  32%|███▎      | 13/40 [11:05<13:49, 30.71s/it]Best trial: 11. Best value: 130.551:  32%|███▎      | 13/40 [11:05<13:49, 30.71s/it]Best trial: 11. Best value: 130.551:  35%|███▌      | 14/40 [11:05<11:59, 27.67s/it]                                                                                    [I 2025-10-06 09:58:14,711] Trial 14 finished with value: 130.5315754424959 and parameters: {'seq_len': 18, 'units': 64, 'dropout': 0.30877183350407733, 'lr': 0.004909113439094563, 'batch': 128, 'epochs': 67}. Best is trial 14 with value: 130.5315754424959.
Best trial: 11. Best value: 130.551:  35%|███▌      | 14/40 [11:34<11:59, 27.67s/it]Best trial: 14. Best value: 130.532:  35%|███▌      | 14/40 [11:34<11:59, 27.67s/it]Best trial: 14. Best value: 130.532:  38%|███▊      | 15/40 [11:34<11:42, 28.10s/it]                                                                                    [I 2025-10-06 09:58:38,623] Trial 15 finished with value: 130.91237079865675 and parameters: {'seq_len': 18, 'units': 64, 'dropout': 0.3259134876019591, 'lr': 0.00491961297296634, 'batch': 256, 'epochs': 72}. Best is trial 14 with value: 130.5315754424959.
